,Tipo_Comida,Calificacion_Comentario,Comentario,Comentario corregido
0,"Mexicana, Pizzer칤a, Mariscos, Costarricense, Saludable",positive,"Fuimos a Pala para cenar y fue espectacular, como siempre, tuvimos la langosta y at칰n cuenco de arroz. 5 estrellas para este lugar y servicio.","Fuimos a Pala para cenar y fue espectacular, como siempre, tuvimos la langosta y at칰n cuenco de arroz. 5 estrellas para este lugar y servicio."
1,"Mariscos, Peruana, Latina, Sudamericana, Centroamericana",positive,"Pedimos el tartar de at칰n como entrada, el Linguini de mariscos y el Pulpo a la parrilla. Muy bueno todo!","Pedimos el tartar de at칰n como entrada, el Linguini de mariscos y el Pulpo a la parrilla. Muy bueno todo!"
2,"Italiana, Pizzer칤a, Saludable",positive,"Un buen lugar para ir en pareja o con amigos en un ambiente agradable y una comida deliciosa!!! Es un lugar tranquilo, como para hablar un rato","Un buen lugar para ir en pareja o con amigos en un ambiente agradable y una comida deliciosa!!! Es un lugar tranquilo, como para hablar un rato"
3,"Latina, Centroamericana, Costarricense",positive,"El lugar tiene una localizaci칩n impresionante, con una vista realmente digna de disfrutar. La comida me pareci칩 un poco cara respecto de la calidad. Si van por la noche, aseguren de llevar abrigo que hace fr칤o all치 arriba!","El lugar tiene una localizaci칩n impresionante, con una vista realmente digna de disfrutar. Si van por la noche, aseguren de llevar abrigo que hace fr칤o all치 arriba!"
4,"Latina, Bar, Centroamericana, Costarricense, Fusi칩n",positive,Tienen que mejorar el servicio al cliente son muy lentos y tener cuidado con la limpieza del lugar pero se come bien la olla de carne es muy Rica la recomiendo,se come bien la olla de carne es muy Rica la recomiendo
5,"China, Asi치tica",,"Est치bamos desesperados por comida china. Sin embargo, para dar contexto, China nativas que tienen altos est치ndares para comida china. Este no la marca. El sabor es claramente dirigido a los Costarricenses, no podr칤a incluso probar encontrar camareros y camareras que hablaban el idioma. Men칰 era en espa침ol/ingl칠s.Me ofrecieron comida t칤pica de que probablemente la mayor칤a no satisfacer todos los paladares chinos. Los precios eran comparables al resto de los restaurantes a los que fuimos, no ""econ칩mico"" si est치s buscando y esperando. bastante caro teniendo en cuenta lo que se estaba dando. No volver칤a otra vez.","Est치bamos desesperados por comida china. Sin embargo, para dar contexto, China nativas que tienen altos est치ndares para comida china. Este no la marca. El sabor es claramente dirigido a los Costarricenses, no podr칤a incluso probar encontrar camareros y camareras que hablaban el idioma. Men칰 era en espa침ol/ingl칠s.Me ofrecieron comida t칤pica de que probablemente la mayor칤a no satisfacer todos los paladares chinos. Los precios eran comparables al resto de los restaurantes a los que fuimos, no ""econ칩mico"" si est치s buscando y esperando. bastante caro teniendo en cuenta lo que se estaba dando. No volver칤a otra vez."
6,"Latina, Bar, Centroamericana, Costarricense, Fusi칩n",positive,"Nuestro hotel recomendado este restaurante y era muy bueno. Yo ten칤a pollo y mi marido ten칤a carne y ambos eran excelentes. No era barato, pero nos dieron un mont칩n de comida para nuestro dinero! R치pido y agradable servicio. Fant치stica ubicaci칩n, justo al otro lado de la calle del Museo Nacional.","Nuestro hotel recomendado este restaurante y era muy bueno. Yo ten칤a pollo y mi marido ten칤a carne y ambos eran excelentes. No era barato, pero nos dieron un mont칩n de comida para nuestro dinero! R치pido y agradable servicio. Fant치stica ubicaci칩n, justo al otro lado de la calle del Museo Nacional."
7,"Mexicana, Internacional",positive,"Visite el restaurante para el almuerzo y probe uno de los platos del menu especial de almuerzo. el lugar es muy lindo, la atencion buena, el precio de este menu es tambien bueno.La comida estaba buena pero no era nada especial y la porcion me parecio un poco pequena.","Visite el restaurante para el almuerzo y probe uno de los platos del menu especial de almuerzo. el lugar es muy lindo, la atencion buena, el precio de este menu es tambien bueno."
8,"Japonesa, Sushi, Asi치tica, Bar, Pub, Saludable",positive,La comida es muy buena y el servicio es estupendo. Me gust칩 mucho este lugar para comer fuera.Yo recomendar칤a a nadie que vaya all칤 y pasar un buen rato,La comida es muy buena y el servicio es estupendo. Me gust칩 mucho este lugar para comer fuera.Yo recomendar칤a a nadie que vaya all칤 y pasar un buen rato
9,"Bar, Pizzer칤a, Costarricense, Sudamericana",positive,Este fue un gran ambiente y un bar que te hizo sentir siempre bienvenida y las bebidas a buen precio,Este fue un gran ambiente y un bar que te hizo sentir siempre bienvenida y las bebidas a buen precio
10,"Latina, Mariscos, Centroamericana, Costarricense",positive,Me encant칩 la salada cesar y el ceviche de pulpo 游냋 saludos desde Brasil 游游 Comida de calidad en Costa Rica,Me encant칩 la salada cesar y el ceviche de pulpo 游냋 saludos desde Brasil 游游 Comida de calidad en Costa Rica
11,Fusi칩n,positive,"El local es precioso, pero la comida tiene que mejorar como el servicio. Yo no estaba impresionado con este lugar. Mantente alejado del ""Cleric칩"" no es bueno en absoluto!",El local es precioso
12,"Latina, Mariscos, Centroamericana, Costarricense, Fusi칩n",positive,"La comida es excelente y a un precio decente, el lugar es muy agradable especialmente para tomar un aperitivo por la tarde y un par de cervezas.","La comida es excelente y a un precio decente, el lugar es muy agradable especialmente para tomar un aperitivo por la tarde y un par de cervezas."
13,"Pizzer칤a, Pub, Estadounidense",positive,"Ambiente arenoso, buen servicio, precios razonables.Mejor hamburguesa en Am칠rica Latina Parking al lado. La cerveza est치 fr칤a.","Ambiente arenoso, buen servicio, precios razonables.Mejor hamburguesa en Am칠rica Latina Parking al lado. La cerveza est치 fr칤a."
14,"Italiana, Mediterr치nea, Pizzer칤a",positive,"Ubicado en el segundo piso de Escaz칰 Village, tiene un men칰 variado sin ser nada fuera de lo com칰n, los platos muy m치s o menos. Nada especial. Servicio bueno Precios medio-alto","Ubicado en el segundo piso de Escaz칰 Village, tiene un men칰 variado sin ser nada fuera de lo com칰n, los platos muy buenos. Servicio bueno Precios medio-alto"
15,"Internacional, Estadounidense, Saludable, Centroamericana, Costarricense, Contempor치nea",positive,"Siempre es un gusto compartir en familia en este restaurante, el personal hace la visita muy amena. Un men칰 muy variado con excelentes precios. En nuestra visita fuimos atendidos por Chestre, exaltamos su grandiosa atenci칩n. Los felicitamos!","Siempre es un gusto compartir en familia en este restaurante, el personal hace la visita muy amena. Un men칰 muy variado con excelentes precios. En nuestra visita fuimos atendidos por Chestre, exaltamos su grandiosa atenci칩n. Los felicitamos!"
16,"Mariscos, Centroamericana, Internacional, Contempor치nea",positive,"Comimos en lim칩n, todo una vez o m치s durante visita a Jaco; siempre es el lugar m치s agradable con la mejor comida y ambiente por lo que a nosotros respecta. Es como un regalo para nosotros, un poco caro, pero vale la pena. Esta vez, a pesar de escuchar todas las ofertas tan capaz recitado de nuestro camarero, Iv치n, elegimos el filet mignon. fue magn칤fico; perfectamente sazonada y preparado, ya que hab칤amos solicitado. preguntamos a o칤r el postre men칰 recitado, pero nos dimos cuenta que realmente no ten칤amos habitaci칩n despu칠s de nuestro perfecto entrante.Volveremos otra vez el pr칩ximo a침o por lo menos una vez durante nuestras vacaciones!","Comimos en lim칩n, todo una vez o m치s durante visita a Jaco; siempre es el lugar m치s agradable con la mejor comida y ambiente por lo que a nosotros respecta. Es como un regalo para nosotros, un poco caro, pero vale la pena. Esta vez, a pesar de escuchar todas las ofertas tan capaz recitado de nuestro camarero, Iv치n, elegimos el filet mignon. fue magn칤fico; perfectamente sazonada y preparado, ya que hab칤amos solicitado. preguntamos a o칤r el postre men칰 recitado, pero nos dimos cuenta que realmente no ten칤amos habitaci칩n despu칠s de nuestro perfecto entrante.Volveremos otra vez el pr칩ximo a침o por lo menos una vez durante nuestras vacaciones!"
17,"Mariscos, Sudamericana, Costarricense",positive,Excelente opci칩n de mariscos frescos!!!Atenci칩n personalizada!! Me com칤 un pargo rojo relleno de mariscos游뱔游뱏游땖,Excelente opci칩n de mariscos frescos!!!Atenci칩n personalizada!! Me com칤 un pargo rojo relleno de mariscos游뱔游뱏游땖
18,"Mexicana, Latina, Peruana, Bar, Sudamericana, Centroamericana, Costarricense",positive,"La decoraci칩n y el ambiente del lugar es genial. Buena m칰sica, tambi칠n. El s치ndwich vegetariano y los tacos no eran nada especial. Volver칤a para bebidas con amigos, ya que hay algunos c칩cteles interesantes.","La decoraci칩n y el ambiente del lugar es genial. Buena m칰sica, tambi칠n. El s치ndwich vegetariano y los tacos no eran muy especiales. Volver칤a para bebidas con amigos, ya que hay algunos c칩cteles interesantes."
19,"Parrilla, Fusi칩n",positive,"Todo sobre Graffiti es genial. Las bebidas son Point, la comida es deliciosa y el personal es muy atento. Volver칠 pronto. :)","Todo sobre Graffiti es genial. Las bebidas son Point, la comida es deliciosa y el personal es muy atento. Volver칠 pronto. :)"
20,"Latina, Mariscos, Centroamericana, Costarricense, Fusi칩n",positive,"Esta es una visita obligada comer en Jaco, el personal es profesional y muy amable, muy servicial y genial comunicadores! Tienen una buena Wiifi y quedamos muy contentos para m칤 para sentarse a 2 1/2 horas, mientras esperaba para un paseo en una tarde. Beb칤 una margarita y ten칤a las alas de pollo que estaban deliciosos! Fuimos a otro d칤a para una comida completa de carne y era preciosa.","Esta es una visita obligada comer en Jaco, el personal es profesional y muy amable, muy servicial y genial comunicadores! Tienen una buena Wiifi y quedamos muy contentos para m칤 para sentarse a 2 1/2 horas, mientras esperaba para un paseo en una tarde. Beb칤 una margarita y ten칤a las alas de pollo que estaban deliciosos! Fuimos a otro d칤a para una comida completa de carne y era preciosa."
21,"Espa침ola, Mediterr치nea",positive,"He ido varias veces y estoy seguro de querer volver. Un men칰 que le recuerda cualquier almuerzo con vista a La Giralda. Hoy tuve el placer de degustar una paella de mariscos con mi familia, adem치s de un cochinillo asado y debo decir que era simplemente espectacular. La porci칩n de paella dice ser para 10, pero alcanza para m치s comensales. El cochinillo, a la altura de los mejores lugares de Espa침a.Todos quedamos satisfechos y contentos de la elecci칩n.","He ido varias veces y estoy seguro de querer volver. Un men칰 que le recuerda cualquier almuerzo con vista a La Giralda. Hoy tuve el placer de degustar una paella de mariscos con mi familia, adem치s de un cochinillo asado y debo decir que era simplemente espectacular. La porci칩n de paella dice ser para 10, pero alcanza para m치s comensales. El cochinillo, a la altura de los mejores lugares de Espa침a.Todos quedamos satisfechos y contentos de la elecci칩n."
22,N/E,positive,"La atenci칩n fue muy buena, el mesero que nos atendi칩 nos dio muy buenas recomendaciones. Comimos como entrada una crema de esp치rragos, de plato fuerte un filete Mignon y un Pulpo al grill, de postre una Panna cotta de frutos rojos. Debo resaltar que la panna cota es DELICIOSA, para los que no somos tan amantes del dulce y nos gusta el 치cido 칠sta es la mezcla perfecta. ","La atenci칩n fue muy buena, el mesero que nos atendi칩 nos dio muy buenas recomendaciones. Comimos como entrada una crema de esp치rragos, de plato fuerte un filete Mignon y un Pulpo al grill, de postre una Panna cotta de frutos rojos. Debo resaltar que la panna cota es DELICIOSA, para los que no somos tan amantes del dulce y nos gusta el 치cido 칠sta es la mezcla perfecta. "
23,"Latina, Costarricense",positive,No hay nada especial en este restaurante. Me sent칤 como si nuestro camarero era molesto que no hablaban espa침ol. Yo ten칤a el plato de marisco y mi marido pidi칩 el chulet칩n. Nuestro servicio no era muy bueno. La vista es estupenda. La comida era normal.,No hay nada especial en este restaurante. Me sent칤 como si nuestro camarero era molesto que no hablaban espa침ol. Yo ten칤a el plato de marisco y mi marido pidi칩 el chulet칩n. Nuestro servicio no era muy bueno. La vista es estupenda. La comida era normal.
24,"Internacional, Mediterr치nea, Europea",positive,"No puedo decir suficientes cosas buenas acerca de este restaurante. La comida se sirve fresco, as칤 que est치 siempre a la temperatura deseada. He comido all칤 varias veces durante mi estancia en Costa Rica, y tiene Benin maravilloso cada vez. Adem치s de la buena comida, los camareros hacen lo imposible para asegurar su satisfacci칩n. Sin duda uno de los mejores restaurantes que he comido.","No puedo decir suficientes cosas buenas acerca de este restaurante. La comida se sirve fresco, as칤 que est치 siempre a la temperatura deseada. He comido all칤 varias veces durante mi estancia en Costa Rica, y tiene Benin maravilloso cada vez. Adem치s de la buena comida, los camareros hacen lo imposible para asegurar su satisfacci칩n. Sin duda uno de los mejores restaurantes que he comido."
25,"Italiana, Pizzer칤a",positive,"Exelente comida, la pizza muy aut칠ntica,  buen servicio trato amable  el tiramisu lo maximo en tama침o y calidad","Exelente comida, la pizza muy aut칠ntica,  buen servicio trato amable  el tiramisu lo maximo en tama침o y calidad"
26,"Mediterr치nea, Espa침ola, Bar de vinos, Catalana",positive,"Estuve viviendo en Espa침a por un a침o y la comida de este lugar es como un pedacito de Barcelona. Es un lugar peque침o pero que ofrece un ambiente acogedor. La atenci칩n fue excelente. Antes de ir, le칤 comentarios de gente en TripAdvisor que hab칤a ido que criticaron el tama침o de la comida... claramente no entienden el concepto espa침ol de ir de tapas. La cantidad de cada tapa estaba magn칤fica . Para empezar recomiendo las alb칩ndigas con una copita de vino. ","Estuve viviendo en Espa침a por un a침o y la comida de este lugar es como un pedacito de Barcelona. Es un lugar peque침o pero que ofrece un ambiente acogedor. La atenci칩n fue excelente. Antes de ir, le칤 comentarios de gente en TripAdvisor que hab칤a ido que criticaron el tama침o de la comida... claramente no entienden el concepto espa침ol de ir de tapas. La cantidad de cada tapa estaba magn칤fica . Para empezar recomiendo las alb칩ndigas con una copita de vino. "
27,De la India,positive,"El lugar peque침o pero bien decorado, ambiente agradable. La comida es muy sabrosa, sabores accesibles y nuevos para quien no conoce de la gastronom칤a. Quiz치s les falta un poco de gu칤a para las personas que no conocen del men칰 y en general la gastronom칤a de la India. El servicio estuvo muy bien, los precios accesibles/normales. El punto alto del lugar es que cuentan con un men칰 inmensamente variado para todos los gustos. ","El lugar peque침o pero bien decorado, ambiente agradable. La comida es muy sabrosa, sabores accesibles y nuevos para quien no conoce de la gastronom칤a. Quiz치s les falta un poco de gu칤a para las personas que no conocen del men칰 y en general la gastronom칤a de la India. El servicio estuvo muy bien, los precios accesibles/normales. El punto alto del lugar es que cuentan con un men칰 inmensamente variado para todos los gustos. "
28,"Estadounidense, Europea, Brit치nica, Australiana, Costarricense, Bar, Comida r치pida",positive,Delicioso el sabor de la comida. Muy buen servicio de atenci칩n. Deliciosas salsas. Completamente recomendado.,Delicioso el sabor de la comida. Muy buen servicio de atenci칩n. Deliciosas salsas. Completamente recomendado.
29,"Italiana, Bar, Internacional, Pub, Napolitana, De Campania, Toscana, De Lombard칤a, Del norte italiano, Del centro italiano, Del sur italiano",positive,El lugar es una edificaci칩n costarricense del siglo pasado. Es un excelente lugar para comer en familia. Sus precios son altos pero vale la pena visitarlo. Lo recomiendo altamente.,El lugar es una edificaci칩n costarricense del siglo pasado. Es un excelente lugar para comer en familia. Sus precios son altos pero vale la pena visitarlo. Lo recomiendo altamente.
30,"Estadounidense, Europea, Brit치nica, Australiana, Costarricense, Bar, Comida r치pida",positive,Jared nos brind칩 un excelente servicio la comida s칰per delicioso estuvo excelente mi visita con mi novio,Jared nos brind칩 un excelente servicio la comida s칰per delicioso estuvo excelente mi visita con mi novio
31,"Latina, Bar, Centroamericana, Costarricense, Fusi칩n",positive,"De visita en Costa Rica - Pura Vida, hoy en el City Tour nos llevaron para almorzar. Rica comida, excelente servicio de Anthony. Gracias por la recomendaci칩n del mojito de cas 游땖","De visita en Costa Rica - Pura Vida, hoy en el City Tour nos llevaron para almorzar. Rica comida, excelente servicio de Anthony. Gracias por la recomendaci칩n del mojito de cas 游땖"
32,"Latina, Bar, Centroamericana, Costarricense, Fusi칩n",positive,"Men칰 amplio, comida t칤pica y diferente, agradable, comida rica, m칰sica en vivo, buena infraestructura con adornos t칤picos","Men칰 amplio, comida t칤pica y diferente, agradable, comida rica, m칰sica en vivo, buena infraestructura con adornos t칤picos"
33,"Latina, Mariscos, Centroamericana, Costarricense",positive,"los precios moderados, buen ambiente y cerca de nuestro hotel! Excelentes platos y postres de comida de mar. 4 de nosotros fuimos y todos disfrutaron de sus comidas.","los precios moderados, buen ambiente y cerca de nuestro hotel! Excelentes platos y postres de comida de mar. 4 de nosotros fuimos y todos disfrutaron de sus comidas."
34,"Cervecer칤a, Pizzer칤a, Gastropub, Centroamericana",positive,"Quer칤amos comer algo r치pido y no muy cargado y la hamburguesa caprese fue un excelente elecci칩n. El pan riqu칤simo, pocas salsas y la carne con poca grasa y bien cocinada; no es tan com칰n comer una hamburguesa tan equilibrada. Cervezas muy buenas, trato amable y precios honestos.","Quer칤amos comer algo r치pido y no muy cargado y la hamburguesa caprese fue un excelente elecci칩n. El pan riqu칤simo, pocas salsas y la carne con poca grasa y bien cocinada; no es tan com칰n comer una hamburguesa tan equilibrada. Cervezas muy buenas, trato amable y precios honestos."
35,"Churrasquer칤a, Mariscos",positive,Comida deliciosa con un gran detalle para mi esposa en su cumplea침os. Servicio de Juan Carlos impecable excelente,Comida deliciosa con un gran detalle para mi esposa en su cumplea침os. Servicio de Juan Carlos impecable excelente
36,"China, Asi치tica",positive,Preguntamos a alguien en la calle donde comer y dijo LaFlor de Loto era la mejor comida china que hab칤a tenido y estamos totalmente de acuerdo. Porciones enormes y todo era tan fresco y sabroso.,Preguntamos a alguien en la calle donde comer y dijo LaFlor de Loto era la mejor comida china que hab칤a tenido y estamos totalmente de acuerdo. Porciones enormes y todo era tan fresco y sabroso.
37,"Mediterr치nea, Espa침ola, Bar de vinos, Catalana",positive,"Nos alojamos en el estudio y, despu칠s de algunas comidas bastante mediocre en este 치rea, est치bamos muy contentos de haber encontrado este restaurante justo al lado.Excelente ambiente y servicio y la comida era estupenda. Setas, langostinos, paella y lomo grande de carne eran tan bueno. Pregunta por el aioli con la carne!","Nos alojamos en el estudio y, despu칠s de algunas comidas bastante mediocre en este 치rea, est치bamos muy contentos de haber encontrado este restaurante justo al lado.Excelente ambiente y servicio y la comida era estupenda. Setas, langostinos, paella y lomo grande de carne eran tan bueno. Pregunta por el aioli con la carne!"
38,Mexicana,positive,"La comida es excelente, los sabores son muy buenos, no es muy barato pero tampoco es muy caro, el ambiente es muy bonito y comodo.","La comida es excelente, los sabores son muy buenos, no es muy barato pero tampoco es muy caro, el ambiente es muy bonito y comodo."
39,"Mediterr치nea, Del Medio Oriente",positive,El lugar es precioso era una antigua casa . Ambiente Mediterr치neo y comida de esta zona ( libanesa arabe etc ) el cordero es espectacular y en general muy muy buena comida los precios no son econ칩micos pero vale la pena,El lugar es precioso era una antigua casa . Ambiente Mediterr치neo y comida de esta zona ( libanesa arabe etc ) el cordero es espectacular y en general muy muy buena comida los precios no son econ칩micos pero vale la pena
40,"Latina, Mariscos, Centroamericana, Costarricense",,"Bien en cuanto al servicio, el lugar, ampl칤simo parqueo, limpieza, en fin, en cuanto a atenci칩n e instalaciones todo bien. El problema es que la comida no llena las expectativas. Me referir칠 a cuatro platos espec칤ficamente.Primero el ceviche de pescado, bien en principio; no obstante ten칤a un ligero gusto a que se hab칤a tratado de incluir ""consom칠"" en polvo o algo similar, lo que le quit칩 toda la frescura al plato. Luego la superensalada, en efecto impresionante en tama침o y variedad, pero con las carnes preparadas con mucha grasa, es de suponer que un cliente que pide una ensalada como plato principal es precisamente porque no desea o no puede consumir alguna comida m치s fuerte, por lo que, incluir ingredientes tan grasosos es un total desprop칩sito.El arroz con cerdo, igualmente algo grasoso, aunque mejor que la ensalada. pero insipidoPor 칰ltimo, el pulpo, otra vez caemos en el problema del exceso de grasa en la preparaci칩n.Al parecer este es el mayor defecto del restaurante, comida demasiado grasosa o no adecuadamente condimentada.Si quisieran podr칤an mejorar bastante en la preparaci칩n","Bien en cuanto al servicio, el lugar, ampl칤simo parqueo, limpieza, en fin, en cuanto a atenci칩n e instalaciones todo bien. El problema es que la comida no llena las expectativas. Me referir칠 a cuatro platos espec칤ficamente.Primero el ceviche de pescado, bien en principio; no obstante ten칤a un ligero gusto a que se hab칤a tratado de incluir ""consom칠"" en polvo o algo similar, lo que le quit칩 toda la frescura al plato. Luego la superensalada, en efecto impresionante en tama침o y variedad, pero con las carnes preparadas con mucha grasa, es de suponer que un cliente que pide una ensalada como plato principal es precisamente porque no desea o no puede consumir alguna comida m치s fuerte, por lo que, incluir ingredientes tan grasosos es un total desprop칩sito.El arroz con cerdo, igualmente algo grasoso, aunque mejor que la ensalada. pero insipidoPor 칰ltimo, el pulpo, otra vez caemos en el problema del exceso de grasa en la preparaci칩n.Al parecer este es el mayor defecto del restaurante, comida demasiado grasosa o no adecuadamente condimentada.Si quisieran podr칤an mejorar bastante en la preparaci칩n"
41,"Italiana, Napolitana",positive,Me gusta participar de las catas porque son muy amenas y se aprende de verdad. Alfredo siempre atento y el chef Dom칠nico explicando siempre la historia y la receta de los platillos tradicionales italianos. Se consigue vinos excelentes a muy buenos precios!,Me gusta participar de las catas porque son muy amenas y se aprende de verdad. Alfredo siempre atento y el chef Dom칠nico explicando siempre la historia y la receta de los platillos tradicionales italianos. Se consigue vinos excelentes a muy buenos precios!
42,"Latina, Centroamericana, Costarricense",positive,Este Mirador es uno de mis favoritos.La vista es exelente la comida muy buena. Cuenta tambien con un bar para aquellos que solo desean ir a tomar algo,Este Mirador es uno de mis favoritos.La vista es exelente la comida muy buena. Cuenta tambien con un bar para aquellos que solo desean ir a tomar algo
43,"Italiana, Pizzer칤a",positive,"Fuimos almorzar en estas excelente Pizza y su due침o nos atenci칩n muy amablemente, tiene mucha variedad y excelente variada carta de vinos.","Fuimos almorzar en estas excelente Pizza y su due침o nos atenci칩n muy amablemente, tiene mucha variedad y excelente variada carta de vinos."
44,"Italiana, Mediterr치nea, Europea, Espa침ola, Pub, Fusi칩n",positive,"Ademas del ambiente bohemio y al nivel de cualquier lugar en grandes ciudades, destaco el excelente servicio que incluso puedo decir que lo han mejorado con respecto a mis visitas previas.La comida no se queda atras, la calidad y variedad en platos mediterraneos e internacionales hacen de este lugar uno de mis preferidos.","Ademas del ambiente bohemio y al nivel de cualquier lugar en grandes ciudades, destaco el excelente servicio que incluso puedo decir que lo han mejorado con respecto a mis visitas previas.La comida no se queda atras, la calidad y variedad en platos mediterraneos e internacionales hacen de este lugar uno de mis preferidos."
