,Tipo_Comida,Calificacion_Comentario,Comentario,Comentario corregido
383,Coreana,positive,"Para celebrar un ocasi칩n especial visitamos el restaurante por primera vez, un ambiente muy acogedor, buena m칰sica de fondo, una variedad de platillos a escoger, comida fusi칩n deliciosa y por los precios dependiendo de su selecci칩n pero razonable, para este tipo de restaurante de franquicia. Pero la atenci칩n del salonero Chistopher fue admirable, nos pregunto si era nuestra primer visita, nos explico casi todo el men칰 y mantuvo una atenci칩n acorde a todo un profesional.","Para celebrar un ocasi칩n especial visitamos el restaurante por primera vez, un ambiente muy acogedor, buena m칰sica de fondo, una variedad de platillos a escoger, comida fusi칩n deliciosa y por los precios dependiendo de su selecci칩n pero razonable, para este tipo de restaurante de franquicia. Pero la atenci칩n del salonero Chistopher fue admirable, nos pregunto si era nuestra primer visita, nos explico casi todo el men칰 y mantuvo una atenci칩n acorde a todo un profesional."
384,"Mariscos, Centroamericana, Internacional, Contempor치nea",positive,"Este lugar sabe c칩mo ponen buena comida. La comida era incre칤ble. El lugar es muy ruidoso, y era dif칤cil de o칤r cada otro hablar. Los camareros son muy atentos. Si puedes sentarte en la terraza, que tiene el mejor ambiente. 100% recomendable.","Este lugar sabe c칩mo ponen buena comida. La comida era incre칤ble. El lugar es muy ruidoso, y era dif칤cil de o칤r cada otro hablar. Los camareros son muy atentos. Si puedes sentarte en la terraza, que tiene el mejor ambiente. 100% recomendable."
385,"Italiana, Mediterr치nea, Europea, Espa침ola, Pub, Fusi칩n",positive,"En general, el lugar est치 muy bien decorado, en una buena ubicaci칩n en San Jos칠. La comida es buena en su mayor칤a espa침ola mediterr치nea con un toque de grek, los precios son asequibles para el tama침o que tienen una buena muestra de tapas pero tambi칠n los platos. No uno espera cocina de alta chef pero la comida es sabrosa.Es el 칰nico punto de estacionamiento es muy peque침o y se llena bastante temprano.","En general, el lugar est치 muy bien decorado, en una buena ubicaci칩n en San Jos칠. La comida es buena en su mayor칤a espa침ola mediterr치nea con un toque de grek, los precios son asequibles para el tama침o que tienen una buena muestra de tapas pero tambi칠n los platos. No uno espera cocina de alta chef pero la comida es sabrosa.Es el 칰nico punto de estacionamiento es muy peque침o y se llena bastante temprano."
386,"Churrasquer칤a, Parrillada, Argentina",positive,"Siempre es un placer visitar este restaurante donde nos atienden personalmente, las entradas chorizo y queso provoleta al oreganato.De plato pricipal media entra침a con papas arturito","Siempre es un placer visitar este restaurante donde nos atienden personalmente, las entradas chorizo y queso provoleta al oreganato.De plato pricipal media entra침a con papas arturito"
387,De la India,positive,"El servicio es muy bueno, el lugar muy acogedor y el ambiente muy bueno, al ser pequeno y cerrado, el olor del curry es muy fuerte, por lo que algunas personas les puede parecer bastente incomodo, con respecto a la comida, pedimos un pollo tikka massala, un plato surtido con cordero, pollo y res y un naan de queso, el plato surtido venia con un curry, pero al final resulto ser el mismo que traia la salsa tikka massala lo cual no deberia ser asi, puesto que son preparaciones distintas, al final ambos platos tenia un fuerte sabor a curry que no permitia ningun otra especie sobresalir. El pan si estaba muy bueno y el arroz, pero los platos principales bastante regular. Precios alrededor de 8000 a 13000 colones ($15-25) por plato","El servicio es muy bueno, el lugar muy acogedor y el ambiente muy bueno, al ser pequeno y cerrado, el olor del curry es muy fuerte, por lo que algunas personas les puede parecer bastente incomodo, con respecto a la comida, pedimos un pollo tikka massala, un plato surtido con cordero, pollo y res y un naan de queso, el plato surtido venia con un curry, pero al final resulto ser el mismo que traia la salsa tikka massala lo cual no deberia ser asi, puesto que son preparaciones distintas, al final ambos platos tenia un fuerte sabor a curry que no permitia ningun otra especie sobresalir. El pan si estaba muy bueno y el arroz, pero los platos principales bastante regular. Precios alrededor de 8000 a 13000 colones ($15-25) por plato"
388,"Japonesa, Sushi, Asi치tica, Tailandesa",positive,"Me gust칩 mucho la comida, la mesera superior informada acerca de todos los platos y un lugar muy acogedor.","Me gust칩 mucho la comida, la mesera superior informada acerca de todos los platos y un lugar muy acogedor."
389,"Japonesa, Sushi, Asi치tica, Saludable",positive,"No fuimos para el almuerzo, tan lleno de gente. No esperaba mucho.Buen sushi. Buen servicio y no muy caro.","No fuimos para el almuerzo, tan lleno de gente. No esperaba mucho.Buen sushi. Buen servicio y no muy caro."
390,"Italiana, Mediterr치nea, Europea",positive,"Simplemente delicioso y un lugar muy rom치ntico, lo recomiendo. Perfecto para celebrar en pareja momentos especiales.","Simplemente delicioso y un lugar muy rom치ntico, lo recomiendo. Perfecto para celebrar en pareja momentos especiales."
391,"Latina, Bar, Centroamericana, Costarricense",positive,"Muy buena elecci칩n en la cuidad .Comida casera  y de mucha calidad . Muy buen servicio .Limpio , sin duda lugar de visita obligada.","Muy buena elecci칩n en la cuidad .Comida casera  y de mucha calidad . Muy buen servicio .Limpio , sin duda lugar de visita obligada."
392,"Latina, Mariscos, Mediterr치nea, Fusi칩n",positive,Una excelente opci칩n en Escazu. Yo prefiero el salm칩n tzatzki o pulpo. La comida es muy buena y el servicio est치 por encima de lo que uno espera en un lugar peque침o como Porto 8.,Una excelente opci칩n en Escazu. Yo prefiero el salm칩n tzatzki o pulpo. La comida es muy buena y el servicio est치 por encima de lo que uno espera en un lugar peque침o como Porto 8.
393,"Internacional, Estadounidense, Saludable, Centroamericana, Costarricense, Contempor치nea",positive,Nos atendi칩 Luis y fue s칰per atento y amable! Muy lindo ambiente. Muy buena la comida recomendado la terraza es muy bonito para estar en pareja y tener una linda cena rom치ntica.,Nos atendi칩 Luis y fue s칰per atento y amable! Muy lindo ambiente. Muy buena la comida recomendado la terraza es muy bonito para estar en pareja y tener una linda cena rom치ntica.
394,"Japonesa, Sushi, Asi치tica, Saludable",positive,"Soy un sushi amante, han tenido sushi todo mi pa칤s y no hemos probado una mejor que 칠ste, me encanta Nau, la comida y la gente de all칤","Soy un sushi amante, han tenido sushi todo mi pa칤s y no hemos probado una mejor que 칠ste, me encanta Nau, la comida y la gente de all칤"
395,"Internacional, Estadounidense, Saludable, Centroamericana, Costarricense, Contempor치nea",positive,"Me encanta que tiene impresionante y delicioso sin gluten opciones gratis!! Muy buena ubicaci칩n y una buena variedad de platos. S칤, lo recomiendo!","Me encanta que tiene impresionante y delicioso sin gluten opciones gratis!! Muy buena ubicaci칩n y una buena variedad de platos. S칤, lo recomiendo!"
396,"Estadounidense, Churrasquer칤a",positive,"Era capaz de conseguir una bebida ... buena comida, excelente servicio. El camarero era en el punto ... no sab칤a c칩mo una cierta bebida estaba hecha, as칤 que busqu칠 y nos dio instrucciones al camarero ... eran muy educado y servicial","Era capaz de conseguir una bebida ... buena comida, excelente servicio. El camarero era en el punto ... no sab칤a c칩mo una cierta bebida estaba hecha, as칤 que busqu칠 y nos dio instrucciones al camarero ... eran muy educado y servicial"
397,"Bar, Pub",positive,"Es un lugar tranquilo, rico y con una muy linda decoraci칩n. Precios normales y buena atenci칩n, recomendado. Tienen una gran variedad de cervezas tanto artesanales como comerciales de distintas marcas, pero tambi칠n cuentan con bebidas no alcoh칩licas, yo me tom칠 una naranja con albahaca y estaba rica, un poco cara para el tama침o eso s칤. ","Es un lugar tranquilo, rico y con una muy linda decoraci칩n. Precios normales y buena atenci칩n, recomendado. Tienen una gran variedad de cervezas tanto artesanales como comerciales de distintas marcas, pero tambi칠n cuentan con bebidas no alcoh칩licas, yo me tom칠 una naranja con albahaca y estaba rica, un poco cara para el tama침o eso s칤. "
398,De la India,positive,"Esta es s칩lo la tercera vez que me han dado cinco estrellas a un restaurante. Me llev칠 a mis clientes de Costa Rica aqu칤 para cenar y mi cliente, siendo India, me dijeron que este lugar era excelente.El restaurante se encuentra en el extremo de un peque침o centro comercial y cuando vas dentro de los aromas de la India son una maravilla. El lugar est치 bien iluminado y decorado con un ambiente muy c치lido y acogedor. Nuestra camarera, la mujer del due침o, era amable y llev칩 a cabo una sonrisa permanente. El servicio era excelente, el vino fue buena, pero la comida era verdaderamente excepcional. Aunque me encanta EN LOS ESTADOS UNIDOS, soy originaria de Inglaterra, as칤 que me encanta la cocina india. Comimos un mont칩n! Por favor, prueba el seekh kebab, cordero a la parrilla y delicada baja formada en un pincho. La mejor que he comido nunca. Tambi칠n prueba El picante naan - el chef operado un restaurante indio en Escocia y creado para la gente. Deliciosos!Una experiencia maravillosa y volver칠. Gracias chef Kamal.","Esta es s칩lo la tercera vez que me han dado cinco estrellas a un restaurante. Me llev칠 a mis clientes de Costa Rica aqu칤 para cenar y mi cliente, siendo India, me dijeron que este lugar era excelente.El restaurante se encuentra en el extremo de un peque침o centro comercial y cuando vas dentro de los aromas de la India son una maravilla. El lugar est치 bien iluminado y decorado con un ambiente muy c치lido y acogedor. Nuestra camarera, la mujer del due침o, era amable y llev칩 a cabo una sonrisa permanente. El servicio era excelente, el vino fue buena, pero la comida era verdaderamente excepcional. Aunque me encanta EN LOS ESTADOS UNIDOS, soy originaria de Inglaterra, as칤 que me encanta la cocina india. Comimos un mont칩n! Por favor, prueba el seekh kebab, cordero a la parrilla y delicada baja formada en un pincho. La mejor que he comido nunca. Tambi칠n prueba El picante naan - el chef operado un restaurante indio en Escocia y creado para la gente. Deliciosos!Una experiencia maravillosa y volver칠. Gracias chef Kamal."
399,"Italiana, Mediterr치nea, Europea",positive,"Con el paso de los a침os, Tony a pesar de haber cambiado varias veces de local, sigue siendo el mismo gran Chef que hemos tenido el placer de conocer por sus platos y su trabajo profesional. Ahora junto a Ciro nos sorprendieron con este nuevo local muy espacioso y con una presentaci칩n impecable de sus platos, ideal para disfrutar un buen almuerzo o cena en un lugar con muy buena atenci칩n y como siempre disfrutando de la gran variedad de platos y recomendaciones de los Chef.","Con el paso de los a침os, Tony a pesar de haber cambiado varias veces de local, sigue siendo el mismo gran Chef que hemos tenido el placer de conocer por sus platos y su trabajo profesional. Ahora junto a Ciro nos sorprendieron con este nuevo local muy espacioso y con una presentaci칩n impecable de sus platos, ideal para disfrutar un buen almuerzo o cena en un lugar con muy buena atenci칩n y como siempre disfrutando de la gran variedad de platos y recomendaciones de los Chef."
400,"Mediterr치nea, Del Medio Oriente",positive,"Comenc칠 a este restaurante hace unos a침os, cuando se llamaba Aya Sofia. Un colega y yo sol칤a comer all칤 cuando trabajamos juntos. Me encanta el cordero platos, las bolas de carne, los platos Sampler, el caf칠 turco, y el baklava. Con los a침os llegu칠 a conocer Mehmet, el propietario. Fui a dos de las noches de arte y cultura ... uno en la comida del Imperio Otomano y la otra en la cocina siria. conversaciones fascinantes / tobog치n presentaciones y la comida es fabulosa. Mehmet y algunos amigos mutuos vinieron a mi casa hace unos a침os y preparado una fiesta. Una delicia. No vivimos en Costa Rica, pero ya he visitado la semana pasada y lo principal en mi horario era para ir a almorzar en Sofia Mediterraneo.","Comenc칠 a este restaurante hace unos a침os, cuando se llamaba Aya Sofia. Un colega y yo sol칤a comer all칤 cuando trabajamos juntos. Me encanta el cordero platos, las bolas de carne, los platos Sampler, el caf칠 turco, y el baklava. Con los a침os llegu칠 a conocer Mehmet, el propietario. Fui a dos de las noches de arte y cultura ... uno en la comida del Imperio Otomano y la otra en la cocina siria. conversaciones fascinantes / tobog치n presentaciones y la comida es fabulosa. Mehmet y algunos amigos mutuos vinieron a mi casa hace unos a침os y preparado una fiesta. Una delicia. No vivimos en Costa Rica, pero ya he visitado la semana pasada y lo principal en mi horario era para ir a almorzar en Sofia Mediterraneo."
401,"Latina, Bar, Centroamericana, Costarricense, Fusi칩n",positive,"Muy local el ambiente pedimos los platos tipicos que tienen lomito uno a la plancha y el otro con salsa de queso excelente sabor y super suaves. Los acompa침amientoe el gallo pinto, platano maduro, ensalada y creo que se llama revoltilo muy buenos La atenci칩n es excelente y la coordialidad del personal","Muy local el ambiente pedimos los platos tipicos que tienen lomito uno a la plancha y el otro con salsa de queso excelente sabor y super suaves. Los acompa침amientoe el gallo pinto, platano maduro, ensalada y creo que se llama revoltilo muy buenos La atenci칩n es excelente y la coordialidad del personal"
402,"Estadounidense, Europea, Brit치nica, Australiana, Costarricense, Bar, Comida r치pida",positive,"Buen recibimiento, excelente lugar, buena presentaci칩n. La comida s칰per rica. La atenci칩n del mesero muy buena y un trato s칰per recomendado. Nos atendi칩 Josue, muy buen trato durante todo el tiempo que permanec칤 ah칤.","Buen recibimiento, excelente lugar, buena presentaci칩n. La comida s칰per rica. La atenci칩n del mesero muy buena y un trato s칰per recomendado. Nos atendi칩 Josue, muy buen trato durante todo el tiempo que permanec칤 ah칤."
403,"Mariscos, Bar, Internacional, Parrilla",positive,Gracias por el hermoso d칤a en isla tortuga y punta coral.  Un placer haber compartido con ustedes. Saludos !!!!,Gracias por el hermoso d칤a en isla tortuga y punta coral.  Un placer haber compartido con ustedes. Saludos !!!!
404,"Latina, Internacional, Contempor치nea, Centroamericana, Costarricense",positive,"El d칤a de ayer mi novia y yo fuimos a su restaurante para celebrar nuestro sexto aniversario. Escogimos dos men칰s degustaci칩n y el maridaje de vinos. La comida fue excelente, tanto en presentaci칩n como en sabor. Gran innovaci칩n de la comida tradicional costarricense.","El d칤a de ayer mi novia y yo fuimos a su restaurante para celebrar nuestro sexto aniversario. Escogimos dos men칰s degustaci칩n y el maridaje de vinos. La comida fue excelente, tanto en presentaci칩n como en sabor. Gran innovaci칩n de la comida tradicional costarricense."
405,"Bar, Pub",positive,"Este comedor hotel es excelente, tanto en el bar como en el comedor. Esperar un servicio r치pido en ambas 치reas con aperitivos muy sabroso o platos principales. Si sentado en el comedor, prep치rese para una vista impresionante del oc칠ano mientras cena. Recomiendo absolutamente comer aqu칤! El precio es justo y la comida es deliciosa!","Este comedor hotel es excelente, tanto en el bar como en el comedor. Esperar un servicio r치pido en ambas 치reas con aperitivos muy sabroso o platos principales. Si sentado en el comedor, prep치rese para una vista impresionante del oc칠ano mientras cena. Recomiendo absolutamente comer aqu칤! El precio es justo y la comida es deliciosa!"
406,"Internacional, Mediterr치nea, Europea",positive,"Sin lugar a dudas Jurgen's es para m칤 de los mejores restaurantes de Costa Rica, el men칰 s칰per variado, cada mes preparan un men칰 especial y en ocasiones prepara platillos especiales incre칤bles para festivales de ""Hamburguesas"" que sin lugar a dudas destacan de cualquier otro, excelente ambiente y atenci칩n ","Sin lugar a dudas Jurgen's es para m칤 de los mejores restaurantes de Costa Rica, el men칰 s칰per variado, cada mes preparan un men칰 especial y en ocasiones prepara platillos especiales incre칤bles para festivales de ""Hamburguesas"" que sin lugar a dudas destacan de cualquier otro, excelente ambiente y atenci칩n "
407,Coreana,positive,"He estado en otros restaurantes de esta cadena pero este me parece superior al resto, la relaci칩n precio calidad es perfecta y la atenci칩n impecable","He estado en otros restaurantes de esta cadena pero este me parece superior al resto, la relaci칩n precio calidad es perfecta y la atenci칩n impecable"
408,"Italiana, Mediterr치nea, Europea",positive,"Podr칤a ser un poco exigente en pasta, y la que tuve aqu칤 no era como recuerdo en Andiamo La Tres Rios, intentar치 otra vez y darle otra oportunidad quiz치s?","Podr칤a ser un poco exigente en pasta, y la que tuve aqu칤 no era como recuerdo en Andiamo La Tres Rios, intentar치 otra vez y darle otra oportunidad quiz치s?"
409,"Mexicana, Internacional",positive,"Un lugar muy acogedor, comida tipo mexicana muy deliciosa... un lugar al que sin duda alguna tengo que regresar...","Un lugar muy acogedor, comida tipo mexicana muy deliciosa... un lugar al que sin duda alguna tengo que regresar..."
410,De la India,positive,La comida y servicio fueron excelentes y la comida es legitima de la India.  Tambi칠n son muy atentos a las necesidades de los vegetarianos y los veganos.,La comida y servicio fueron excelentes y la comida es legitima de la India.  Tambi칠n son muy atentos a las necesidades de los vegetarianos y los veganos.
411,"Latina, Costarricense",positive,"Cenamos aqu칤 ayer por la tarde, que consist칤a de lubina, horneado, ensalada de patatas. Fue una de las cenas m치s deliciosas que hemos tenido en este viaje. Recomiendo encarecidamente este restaurante. Era un entorno muy, muy bonito por la noche","Cenamos aqu칤 ayer por la tarde, que consist칤a de lubina, horneado, ensalada de patatas. Fue una de las cenas m치s deliciosas que hemos tenido en este viaje. Recomiendo encarecidamente este restaurante. Era un entorno muy, muy bonito por la noche"
412,"Churrasquer칤a, Latina, Centroamericana, Costarricense",positive,"Fuimos al restaurante muy buena la atencion y los cortes de carne la comida estuvo muy buena. Buen estacionamiento.y hasta un play donde jugar cn los ni침os. Y el hotel muy bueno y bonito la atencion muy amena,lo recomiendo.","Fuimos al restaurante muy buena la atencion y los cortes de carne la comida estuvo muy buena. Buen estacionamiento.y hasta un play donde jugar cn los ni침os. Y el hotel muy bueno y bonito la atencion muy amena,lo recomiendo."
413,Internacional,positive,"Situado en el centro y al lado de una inusual tienda de antig칲edades (propiedad de su novia) la comida, la presentaci칩n, el servicio y el ambiente eran sorprendentemente fabuloso. Los 3 peque침os platos eran sin duda mucho para saciar mi apetito y rematado con un postre riqu칤simo. y el vino y copa despu칠s de la cena tambi칠n contribuy칩 a la perfecci칩n. Definitivamente regresar칠 en este viaje.","Situado en el centro y al lado de una inusual tienda de antig칲edades (propiedad de su novia) la comida, la presentaci칩n, el servicio y el ambiente eran sorprendentemente fabuloso. Los 3 peque침os platos eran sin duda mucho para saciar mi apetito y rematado con un postre riqu칤simo. y el vino y copa despu칠s de la cena tambi칠n contribuy칩 a la perfecci칩n. Definitivamente regresar칠 en este viaje."
414,"Latina, Bar, Centroamericana, Costarricense",positive,"El ambiente es agradable, la atenci칩n es muy buena, y los precios accesibles, es una buena opci칩n para ir despu칠s del trabajo!!!","El ambiente es agradable, la atenci칩n es muy buena, y los precios accesibles, es una buena opci칩n para ir despu칠s del trabajo!!!"
415,"Italiana, Mediterr치nea, Europea",positive,"La comida y el servicio te hacen sentir en Italia, un lugar acogedor, excelentes vinos y la comida exquisita!!!","La comida y el servicio te hacen sentir en Italia, un lugar acogedor, excelentes vinos y la comida exquisita!!!"
416,"Italiana, Mediterr치nea, Europea",positive,"Un lugar muy agradable, bien pensado y con arquitectura elegante y c칩moda. El servicio de primera clase.La comida bastante bien, pedimos un carpaccio de lomo muy correcto, un rissoto de hongos fant치stico y una pasta con mariscos de 10 puntos.Un amigo nos hab칤a sugerido pedir el vino de la casa que result칩 ser un Tempranillo que de entrada no me pareci칩 maravilloso, pero una vez que se ""abri칩"" result칩 muy agradable. No es barato, pero creo que el precio corresponde al buen establecimiento y la comida bien hecha. Volver칤a con gusto.","Un lugar muy agradable, bien pensado y con arquitectura elegante y c칩moda. El servicio de primera clase.La comida bastante bien, pedimos un carpaccio de lomo muy correcto, un rissoto de hongos fant치stico y una pasta con mariscos de 10 puntos.Un amigo nos hab칤a sugerido pedir el vino de la casa que result칩 ser un Tempranillo que de entrada no me pareci칩 maravilloso, pero una vez que se ""abri칩"" result칩 muy agradable. No es barato, pero creo que el precio corresponde al buen establecimiento y la comida bien hecha. Volver칤a con gusto."
417,"Internacional, Estadounidense, Saludable, Centroamericana, Costarricense, Contempor치nea",positive,"El servicio de comida era incre칤ble, Yisnary era genial! El ambiente es precioso y todo el mundo es muy servicial! Realmente recomiendo el mercado! Lo mejor de todo es que est치 abierta las 24 horas y es muy seguro! Por favor venga a probar el buffet desayuno maravilloso! 칌am 침am!El desayuno es delicioso y el personal y el servicio de Yisnary espectacular! Me encanto!","El servicio de comida era incre칤ble, Yisnary era genial! El ambiente es precioso y todo el mundo es muy servicial! Realmente recomiendo el mercado! Lo mejor de todo es que est치 abierta las 24 horas y es muy seguro! Por favor venga a probar el buffet desayuno maravilloso! 칌am 침am!El desayuno es delicioso y el personal y el servicio de Yisnary espectacular! Me encanto!"
418,"Latina, Mediterr치nea, Espa침ola, Internacional",positive,"No todo es t칤picamente Costa Rica, pero las tapas fueron la mejor comida que tuvimos, 춰aparte de las casas de familia! El restaurante estaba lleno de familias costarricenses, lo que parec칤a una buena se침al. Ambiente agradable, excelente relaci칩n calidad-precio y a la vuelta de la esquina del fabuloso hostal, The Garden.","No todo es t칤picamente Costa Rica, pero las tapas fueron la mejor comida que tuvimos, 춰aparte de las casas de familia! El restaurante estaba lleno de familias costarricenses, lo que parec칤a una buena se침al. Ambiente agradable, excelente relaci칩n calidad-precio y a la vuelta de la esquina del fabuloso hostal, The Garden."
419,Internacional,positive,"Este es un buen lugar para pasar el rato con amigos o familia. La comida es genial, el servicio, excelente -en tiempo y en una buena manera-.  El lugar es muy agradable con un ambiente internacional.","Este es un buen lugar para pasar el rato con amigos o familia. La comida es genial, el servicio, excelente -en tiempo y en una buena manera-.  El lugar es muy agradable con un ambiente internacional."
420,"Japonesa, Sushi, Asi치tica, Bar, Pub, Saludable",positive,"Tsunami Sushi es un gran hallazgo. Especialmente el mi칠rcoles y viernes cuando ofrecen unos 15 de sus rollos a mitad de precio. trato de hacer por lo menos dos veces al mes. Jefferson uno de los chefs es maravillosa y conoce su negocio. Especialmente buenos son el tempura vegetal y el rollo de Jaco, delicioso. No se preocupe si no eres un fan치tico de sushi, tienen un excelente men칰 con todo tipo de opciones. El arroz frito es el mejor! Bien vale la pena el viaje si eres un fan치tico de sushi.","Tsunami Sushi es un gran hallazgo. Especialmente el mi칠rcoles y viernes cuando ofrecen unos 15 de sus rollos a mitad de precio. trato de hacer por lo menos dos veces al mes. Jefferson uno de los chefs es maravillosa y conoce su negocio. Especialmente buenos son el tempura vegetal y el rollo de Jaco, delicioso. No se preocupe si no eres un fan치tico de sushi, tienen un excelente men칰 con todo tipo de opciones. El arroz frito es el mejor! Bien vale la pena el viaje si eres un fan치tico de sushi."
421,"Mediterr치nea, Peruana, Fusi칩n",positive,De veras que siempre que hemos estado es muy agradable ver que siempre lleno eso deja ver que hacen bien las cosas ... Hoy todo perfecto y rico ... S칰per recomendado ... Recuerden llamar para reservar 游녨游녨游녨,De veras que siempre que hemos estado es muy agradable ver que siempre lleno eso deja ver que hacen bien las cosas ... Hoy todo perfecto y rico ... S칰per recomendado ... Recuerden llamar para reservar 游녨游녨游녨
