,Tipo_Comida,Calificacion_Comentario,Comentario,Comentario corregido
119,"Centroamericana, Costarricense, Espa침ola, Sudamericana",positive,Buena opcion para almuerzo ejecutivo. Delicioso sabor. Cliente frecuente del casado. Los precios han incrementado mucho ultimamente.,Buena opcion para almuerzo ejecutivo. Delicioso sabor. Cliente frecuente del casado.
120,"Churrasquer칤a, Mariscos",positive,"Excelente restaurante.Las entradas son sabrosas y de verdad tienen muy buenos cortes de carne.Es un restaurante para ir en familia o con la esposa, y para reuniones de negocios es espectacular por el buen servicio que tienen.","Excelente restaurante.Las entradas son sabrosas y de verdad tienen muy buenos cortes de carne.Es un restaurante para ir en familia o con la esposa, y para reuniones de negocios es espectacular por el buen servicio que tienen."
121,"Italiana, Mediterr치nea, Europea",positive,"Servicio: los meseros muy atentos y traen todo lo que se les pide, adem치s de explicar cada plato.Calidad de la comida: exquisita.Relaci칩n calidad comida/precio: demasiado caro, a칰n con lo bueno de la comida.Ambiente: elegante, algo peque침o pero acogedor. Los detalles de las mesas son muy bien cuidados.","Servicio: los meseros muy atentos y traen todo lo que se les pide, adem치s de explicar cada plato.Calidad de la comida: exquisita.Relaci칩n calidad comida/precio: demasiado caro, a칰n con lo bueno de la comida.Ambiente: elegante, algo peque침o pero acogedor. Los detalles de las mesas son muy bien cuidados."
122,"Mariscos, Centroamericana, Internacional, Contempor치nea",positive,"Fui all칤 con mi familia para mi cumplea침os. Las bebidas eran diferentes, inventiva y fuera de este mundo. La comida era absolutamente excepcional. Este es un lugar en el que puedan competir con los mejores restaurantes en cualquier ciudad importante. El servicio era genial. sin duda har치n sentirse que aprecian su patrocinio. Sin duda una de las mejores comidas que he comido en mucho tiempo. Es de visita obligada.","Fui all칤 con mi familia para mi cumplea침os. Las bebidas eran diferentes, inventiva y fuera de este mundo. La comida era absolutamente excepcional. Este es un lugar en el que puedan competir con los mejores restaurantes en cualquier ciudad importante. El servicio era genial. sin duda har치n sentirse que aprecian su patrocinio. Sin duda una de las mejores comidas que he comido en mucho tiempo. Es de visita obligada."
123,Internacional,positive,"Caf칠 mundo es interesante desde el momento en que se entra. Est치 muy bien decorado y cuenta con grandes salones que te da la opci칩n de ir a almorzar con grupos de amigos.Yo lo visito a menudo para el almuerzo y las opciones de plato del d칤a siempre son muy buenas.Tradici칩n en este restaurante es cuando te traen el pan que consiste en tres tipos de panes , debes de mojarlos en aceite de oliva aromatizados y comerlo antes de que llegue la comida.Los frescos naturales son muy buenos, y al final siempre te dan una peque침a muestra de postre como cortes칤a.En las noches tiene tambi칠n su ambiente y es ideal para tomarse un vinito.","Caf칠 mundo es interesante desde el momento en que se entra. Est치 muy bien decorado y cuenta con grandes salones que te da la opci칩n de ir a almorzar con grupos de amigos.Yo lo visito a menudo para el almuerzo y las opciones de plato del d칤a siempre son muy buenas.Tradici칩n en este restaurante es cuando te traen el pan que consiste en tres tipos de panes , debes de mojarlos en aceite de oliva aromatizados y comerlo antes de que llegue la comida.Los frescos naturales son muy buenos, y al final siempre te dan una peque침a muestra de postre como cortes칤a.En las noches tiene tambi칠n su ambiente y es ideal para tomarse un vinito."
124,De la India,positive,"Excelente atenci칩n, y comida deliciosa!! Adem치s de peque침os detalles como una cortes칤a de uno de sus de platillos (era un tipo de pan hecho con lentejas y otros ingredientes; no me recuerdo su nombre), son detalles que llenan de satisfacci칩n y ganas de visitarlos nuevamente.","Excelente atenci칩n, y comida deliciosa!! Adem치s de peque침os detalles como una cortes칤a de uno de sus de platillos (era un tipo de pan hecho con lentejas y otros ingredientes; no me recuerdo su nombre), son detalles que llenan de satisfacci칩n y ganas de visitarlos nuevamente."
125,"Parrilla, Fusi칩n",positive,No estoy seguro de c칩mo preparar su carne pero era la mejor carne que he probado en mi vida. No puedo parar pensar en ella. Se admiten perros de ma칤z de langosta y aperitivo de at칰n caj칰n eran alucinantes. Me encanta este lugar!,No estoy seguro de c칩mo preparar su carne pero era la mejor carne que he probado en mi vida. No puedo parar pensar en ella. Se admiten perros de ma칤z de langosta y aperitivo de at칰n caj칰n eran alucinantes. Me encanta este lugar!
126,"Asi치tica, Coreana",positive,"S칰per recomendado por su ambiente, por su atenci칩n al cliente, y el extraordinario sabor en sus comidas, un lugar perfecto para reunirse con la familia y amigos, por las tardes es un lugar genial para reuniones de trabajo con deliciosos platillos Coreanos.","S칰per recomendado por su ambiente, por su atenci칩n al cliente, y el extraordinario sabor en sus comidas, un lugar perfecto para reunirse con la familia y amigos, por las tardes es un lugar genial para reuniones de trabajo con deliciosos platillos Coreanos."
127,"Japonesa, Sushi, Asi치tica, Saludable",positive,Es nuestro restaurante preferido de Sushi y es especialmente excepcional la atenci칩n de Marianela y Edward. Especialmente es espectacular la sopa de mariscos que es la primera vez que la pedimos,Es nuestro restaurante preferido de Sushi y es especialmente excepcional la atenci칩n de Marianela y Edward. Especialmente es espectacular la sopa de mariscos que es la primera vez que la pedimos
128,"Latina, Fuente de soda, Centroamericana, Costarricense",positive,"Soda tapia tiene buenas comidas, pero muchas veces los precios son elevados para la poca calidad de servicios que tienen, no son muy disgustativos, podr칤an mejorar","Soda tapia tiene buenas comidas, pero muchas veces los precios son elevados para la poca calidad de servicios que tienen, no son muy disgustativos, podr칤an mejorar"
129,"Mexicana, Pizzer칤a, Mariscos, Costarricense, Saludable",positive,Nos fuimos con una familia de 6 personas y todos disfrutamos de la comida! Tuve fajitas de carne empaquetada en mozzarella frita y fue una de las mejores comidas que he tenido. Servicio r치pido y amable.,Nos fuimos con una familia de 6 personas y todos disfrutamos de la comida! Tuve fajitas de carne empaquetada en mozzarella frita y fue una de las mejores comidas que he tenido. Servicio r치pido y amable.
130,Hawaiana,positive,"El lugar es peque침o pero uno se acomoda, es limpio y el servicio es amable y es simple: pida un bowl, ll칠nelo con lo que desee. Todos los productos se ve칤an frescos y la variedad es muy buena. Mi plato estaba delicioso, es comida muy saludable y a precio razonable. Ideal para almorzar.","El lugar es peque침o pero uno se acomoda, es limpio y el servicio es amable y es simple: pida un bowl, ll칠nelo con lo que desee. Todos los productos se ve칤an frescos y la variedad es muy buena. Mi plato estaba delicioso, es comida muy saludable y a precio razonable. Ideal para almorzar."
131,"Italiana, Delicatessen, Pizzer칤a, Bar de vinos, Del norte italiano",positive,"Lugar acogedor, comida apenas OK. Pagu칠 un poco m치s de 30 euros por dos copas de Verdejo y una pasta con salsa de tomate, rodeada de unos pocos camarones que les falt칩 cocci칩n y berenjena. Era la pasta del chef, esperaba mucho m치s.","Lugar acogedor, comida apenas OK. Pagu칠 un poco m치s de 30 euros por dos copas de Verdejo y una pasta con salsa de tomate, rodeada de unos pocos camarones que les falt칩 cocci칩n y berenjena. Era la pasta del chef, esperaba mucho m치s."
132,"Caribe침a, Mariscos, Centroamericana, Jamaiquina, Costarricense",positive,"tuvimos una muy buena comida en este restaurante, sin duda volver칠. Es una tem치tica caribe침a, tuve el pollo Jerk. estaba realmente delicioso. Nos trajeron un magn칤fico aperitivo de la casa, poco tazas de pl치tano frito con rellenos diferentes. El vino era buena, no cabe duda de que no es la mejor elecci칩n, pero funcion칩 para nuestro grupo. entorno es una casa antigua, muy ""isla informal"" sensaci칩n. Nos encant칩 y se lo recomendar칤a a mis amigos.","tuvimos una muy buena comida en este restaurante, sin duda volver칠. Es una tem치tica caribe침a, tuve el pollo Jerk. estaba realmente delicioso. Nos trajeron un magn칤fico aperitivo de la casa, poco tazas de pl치tano frito con rellenos diferentes. El vino era buena, no cabe duda de que no es la mejor elecci칩n, pero funcion칩 para nuestro grupo. entorno es una casa antigua, muy ""isla informal"" sensaci칩n. Nos encant칩 y se lo recomendar칤a a mis amigos."
133,"Japonesa, Sushi, Asi치tica",positive,"Amo este lugar, la atenci칩n es excelente y el sushi es de lo mejor, voy seguido y siempre salgo s칰per satisfecha. El mejor de jaco!","Amo este lugar, la atenci칩n es excelente y el sushi es de lo mejor, voy seguido y siempre salgo s칰per satisfecha. El mejor de jaco!"
134,"Italiana, Pizzer칤a, Mediterr치nea",positive,"muy buena pasta y servicio, bien situado en Escazu, Personalmente attented by propietarios, italianos y asequible","muy buena pasta y servicio, bien situado en Escazu, Personalmente attented by propietarios, italianos y asequible"
135,"Italiana, Mediterr치nea, Europea",positive,"Localizado en una hermosa zona, el local es agradable. No tiene parqueo, pero los carros de pueden dejar al frente, al lado de la calle, sin mayor inconveniente.Fina atenci칩n, comida italiana con variedad de pastas, pizzas y carnes.El precio es el justo y el tama침o de las porciones el adecuado.Sus due침os, Ciro y Tony, contribuyen con la atenci칩n del lugar.","Localizado en una hermosa zona, el local es agradable. No tiene parqueo, pero los carros de pueden dejar al frente, al lado de la calle, sin mayor inconveniente.Fina atenci칩n, comida italiana con variedad de pastas, pizzas y carnes.El precio es el justo y el tama침o de las porciones el adecuado.Sus due침os, Ciro y Tony, contribuyen con la atenci칩n del lugar."
136,"Centroamericana, Costarricense, Espa침ola",positive,Vivimos en San Isidro y despu칠s de leer las excelentes cr칤ticas decidimos probarlo. El Pinto ten칤a un viejo gusto y sensaci칩n. Las tortillas estaban muy buenas. Los maduros tambi칠n estaban bien. Huevos. . bien. . regular. El ambiente es fant치stico en un moderno centro comercial. Espero que mejoren su comida ya que nos encantar칤a volver a revisar lo que todo el mundo est치 recogiendo y que definitivamente no.,Vivimos en San Isidro y despu칠s de leer las excelentes cr칤ticas decidimos probarlo. El Pinto ten칤a un viejo gusto y sensaci칩n. Las tortillas estaban muy buenas. Los maduros tambi칠n estaban bien. Huevos. . bien. . regular. El ambiente es fant치stico en un moderno centro comercial. Espero que mejoren su comida ya que nos encantar칤a volver a revisar lo que todo el mundo est치 recogiendo y que definitivamente no.
137,"Japonesa, Sushi, Asi치tica, Saludable",positive,"La frescura y calidad de los pescados me llam칩 la atenci칩n. Ped칤 sashimi de salm칩n y nigiris de at칰n, salm칩n, pulpo y anguila y todos se deshac칤an en la boca. Los precios no son baratos pero la calidad lo compensa. ","La frescura y calidad de los pescados me llam칩 la atenci칩n. Ped칤 sashimi de salm칩n y nigiris de at칰n, salm칩n, pulpo y anguila y todos se deshac칤an en la boca. Los precios no son baratos pero la calidad lo compensa. "
138,"China, Asi치tica",positive,"La tarde de llegada, con hambre y encontrarse con tan amplio men칯 fue estupendo. Buena comida y atenci칩n.Este restaurante me lo recomendaron en Panam치,antes de salir de viaje..","La tarde de llegada, con hambre y encontrarse con tan amplio men칯 fue estupendo. Buena comida y atenci칩n.Este restaurante me lo recomendaron en Panam치,antes de salir de viaje.."
139,"Internacional, Centroamericana",positive,"Producto relaci칩n precio es excelente la barra de ensaladas todo bien, rico saludable buenas porciones y adem치s tienen cerveza! Los jugos diferentes y ricos. Lugar bonito y abierto.","Producto relaci칩n precio es excelente la barra de ensaladas todo bien, rico saludable buenas porciones y adem치s tienen cerveza! Los jugos diferentes y ricos. Lugar bonito y abierto."
140,"Costarricense, Estadounidense, Sudamericana, Centroamericana",positive,"Era un lugar de diversi칩n con feliz personal, la comida era buenos precios fueron justos, ojal치 estuviera all칤 ahora tener una de sus fant치sticas bebidas","Era un lugar de diversi칩n con feliz personal, la comida era buenos precios fueron justos, ojal치 estuviera all칤 ahora tener una de sus fant치sticas bebidas"
141,Pizzer칤a,positive,"Esto nos fue recomendado por un viajero de compatriotas. La pizza es plaza, se entregan a domicilio y la comida era fresca, corteza era fresco.","Esto nos fue recomendado por un viajero de compatriotas. La pizza es cuadrada, se entregan a domicilio y la comida era fresca, era fresco."
142,"Italiana, Mariscos, Mediterr치nea, Europea",positive,Excelente servicio y la comida deliciosa!! Definitivamente recomiendo el restaurante. Estuvieron muy atentos para cualquier cosa que necesit치ramos. :) *****,Excelente servicio y la comida deliciosa!! Definitivamente recomiendo el restaurante. Estuvieron muy atentos para cualquier cosa que necesit치ramos. :) *****
143,De la India,positive,Excelente variedad de platos. Probamos cordero y pollo y ambos est치n muy bien. Los precios incluido un refresco natural andan alrededor de 15.000 por persona,Excelente variedad de platos. Probamos cordero y pollo y ambos est치n muy bien. Los precios incluido un refresco natural andan alrededor de 15.000 por persona
144,Caf칠,positive,"Este es un gran lugar que sigo viniendo a incluso cuando tengo aterriz칩 en CR. Buena ubicaci칩n desde una carretera muy transitada, as칤 que es tranquilo. La comida es incre칤ble, sabores podr치 degustar y apreciar con ingredientes frescos y naturales. Aquellos que realmente aprecian comer bien, le encantar치 este lugar. La gente que se queja sobre el precio debe haber estado buscando un sandwich de 1$. No me importa pagar por la comida que tiene calidad se puede ver, oler y degustar. Los precios no son baratos pero no son caros. Lo que valen la pena experimentar. Pr칩xima visita: s치ndwich Caprese est치 en mi lista!","Este es un gran lugar que sigo viniendo a incluso cuando tengo aterriz칩 en CR. Buena ubicaci칩n desde una carretera muy transitada, as칤 que es tranquilo. La comida es incre칤ble, sabores podr치 degustar y apreciar con ingredientes frescos y naturales. Aquellos que realmente aprecian comer bien, le encantar치 este lugar. La gente que se queja sobre el precio debe haber estado buscando un sandwich de 1$. No me importa pagar por la comida que tiene calidad se puede ver, oler y degustar. Los precios no son baratos pero no son caros. Lo que valen la pena experimentar. Pr칩xima visita: s치ndwich Caprese est치 en mi lista!"
145,"Estadounidense, Bar, Pub, Centroamericana",positive,"Depende el d칤a o la hora es muy dificil entrar sin reservaci칩n. Y cuando el lugar se encuentra lleno es cierto que los meseros se les dificulta tomar las ordenes o traer la cuenta y que a ratos hay que insisitir. Eso si por tomada la orden no sent칤 no pasa mucho tiempo para recibir la orden. Pedimos un ceviche que no fue de nuestro agrado y lo retiraron de la mesa sin preguntar el porque. Las alitas si estaban aceptables. Aunque por mucho no es un lugar Gourmet, hay buenas hamburguesas. Y la variedad de cervezas es amplia. Las limonadas no las recomiendo. Lo de los precios pues no es un lugar que se pueda considerar barato aunque tampoco lo veo excesivo. Al llegar la muchacha que nos llevo al reservado muy amable y el mesero tambien pero a una amistad argentina que iba con nosotros y pidio la cuenta de buena manera por segunda vez una muchacha rubia y alta se la dio de p칠sima manera. Me parece que es un lugar que cumple con lo que dice sin ser claro un lugar gourmet o de especialidades... ","Aunque por mucho no es un lugar Gourmet, hay buenas hamburguesas. Y la variedad de cervezas es amplia. Las limonadas las recomiendo. Lo de los precios pues no es un lugar que se pueda considerar barato aunque tampoco lo veo excesivo. Al llegar la muchacha que nos llevo al reservado muy amable y el mesero tambien. Me parece que es un lugar que cumple con lo que dice sin ser claro un lugar gourmet o de especialidades... "
146,"Estadounidense, Bar, Saludable, Centroamericana, Costarricense, Internacional",positive,"Me encanta este lugar! Deliciosa comida fresca, un ambiente fresco y un gran servicio. Su espacioso y tiene una gran sensaci칩n. Lo recomiendo encarecidamente.","Me encanta este lugar! Deliciosa comida fresca, un ambiente fresco y un gran servicio. Su espacioso y tiene una gran sensaci칩n. Lo recomiendo encarecidamente."
147,"Peruana, Latina, Mariscos",positive,Fuimos a este restaurante para probar algo de comida peruana y nos encontramos con una excelente calidad en los cebiches y pescados y con un servicio muy bueno. Ambiente muy agradable.,Fuimos a este restaurante para probar algo de comida peruana y nos encontramos con una excelente calidad en los cebiches y pescados y con un servicio muy bueno. Ambiente muy agradable.
148,"Bar, Mediterr치nea, Espa침ola",positive,Es un lugar atendido de forma personal y especial por los socios.. excelente comida y excelentes precios,Es un lugar atendido de forma personal y especial por los socios.. excelente comida y excelentes precios
149,"Churrasquer칤a, Latina, Argentina",positive,"He visitado este restaurante unas 3 veces, el servicio es bueno y en dos ocasiones la comida estaba excelente, pero, en mi m치s reciente visita, la calidad de los cortes no era buena. Pedimos cortes argentinos pero parec칤an costarricenses y no estaban al nivel de los que nos hab칤an dado en otras ocasiones.Lo m치s grave de esa m치s reciente visita fue que, al pagar la cuenta, nos cobraron un sobreprecio de casi 50mil, incluyendo una botella de vino y alimentos no pedidos..Nunca antes hemos revisado la cuenta y nos queda la impresi칩n de que esto no es un error ocasional, pues al hacer el reclamo, la respuesta del mesero fue que eso no hac칤a intencionalmente. Una respuesta extra침a, pues lo esperable es una disculpa inmediata, ni modo que el mesero dijera que era intencional y que los hab칤amos pillado. Recomiendo mucho cuidado al ordenar y, especialmente, al pagar.","He visitado este restaurante unas 3 veces, el servicio es bueno y en dos ocasiones la comida estaba excelente"
150,"Italiana, Bar, Internacional, Pub, Napolitana, De Campania, Toscana, De Lombard칤a, Del norte italiano, Del centro italiano, Del sur italiano",positive,"El lugar muy bonito, el personal muy amable, nos instruyeron bien al ser la primer visita, los precios normales, la comida muy rica. Se ve que es mejor reservar antes de ir. Excelente y lo recomiendo","El lugar muy bonito, el personal muy amable, nos instruyeron bien al ser la primer visita, los precios normales, la comida muy rica. Se ve que es mejor reservar antes de ir. Excelente y lo recomiendo"
151,"Internacional, Estadounidense, Saludable, Centroamericana, Costarricense, Contempor치nea",positive,Excelente el lomo de corvina el servicio genial Christopher muy atento! El ambiente muy agradable con men칰 de comidas variado,Excelente el lomo de corvina el servicio genial Christopher muy atento! El ambiente muy agradable con men칰 de comidas variado
152,"De la India, Asi치tica, Internacional",positive,"Somos unos apasionados de la cocina tradicional India. Ayer por primera vez vimos el restaurante, vimos las rese침as en TA , nos decidimos a probarlo hoy, y realmente estuvo Extraordinaria la comida como lo mencionan en otra rese침a. Indian Palace (fuimos al de escaz칰) nos deleit칩 con la magia de los sabores en sus platos. La comida estuvo realmente exquisita, elaborada al momento con excelentes ingredientes (cilantro, cardamomo, pistacho, canela, etc). La calidad y el precio muy bien. La atenci칩n muy buena, el chef muy amable reci칠n llegado de Mumbai!Lo recomendamos totalmente!!","Somos unos apasionados de la cocina tradicional India. Ayer por primera vez vimos el restaurante, vimos las rese침as en TA , nos decidimos a probarlo hoy, y realmente estuvo Extraordinaria la comida como lo mencionan en otra rese침a. Indian Palace (fuimos al de escaz칰) nos deleit칩 con la magia de los sabores en sus platos. La comida estuvo realmente exquisita, elaborada al momento con excelentes ingredientes (cilantro, cardamomo, pistacho, canela, etc). La calidad y el precio muy bien. La atenci칩n muy buena, el chef muy amable reci칠n llegado de Mumbai!Lo recomendamos totalmente!!"
153,"Peruana, Latina, Mariscos",positive,"Los visitamos con frecuencia; muy buen ambiente, la atenci칩n de parte del personal excelente y la comida ni qu칠 decir!","Los visitamos con frecuencia; muy buen ambiente, la atenci칩n de parte del personal excelente y la comida ni qu칠 decir!"
154,"Pizzer칤a, Pub, Estadounidense",positive,Buenas hamburguesas y para todos los gustos... Vale la pena ir el men칰 es muy variado y la atenci칩n es buena,Buenas hamburguesas y para todos los gustos... Vale la pena ir el men칰 es muy variado y la atenci칩n es buena
155,"Estadounidense, Bar",positive,una opci칩n relativamente de bajo costo en el tiempo Plaza / Avenida zona esccazu. buenas hamburguesas que podr치 dise침ar usted mismo de una amplia gama de ingredientes.,una opci칩n relativamente de bajo costo en el tiempo Plaza / Avenida zona esccazu. buenas hamburguesas que podr치 dise침ar usted mismo de una amplia gama de ingredientes.
156,"Latina, Bar, Centroamericana, Costarricense, Fusi칩n",positive,"Muy buen local para probar buena comida costarricense. Pedimos un plato para dos personas donde vienen varias diferentes tipos de comidas t칤picas y estubo delicioso. Adem치s la atenci칩n de nuestro mozo (Anthony) estubo espectacular, muy atento y simp치tico. Hasta nos regalaron una foto con nuestro plataso. El local es bien bonito y limpio. Recomiendo este restaurante a cualquiera que sea nuevo en Costa Rica (o no) y quiera comer algo super rico, t칤pico y quiera una muy buena atenci칩n. 10/10","Muy buen local para probar buena comida costarricense. Pedimos un plato para dos personas donde vienen varias diferentes tipos de comidas t칤picas y estubo delicioso. Adem치s la atenci칩n de nuestro mozo (Anthony) estubo espectacular, muy atento y simp치tico. Hasta nos regalaron una foto con nuestro plataso. El local es bien bonito y limpio. Recomiendo este restaurante a cualquiera que sea nuevo en Costa Rica (o no) y quiera comer algo super rico, t칤pico y quiera una muy buena atenci칩n. 10/10"
157,Mariscos,positive,"Normalmente vengo por calidad que son buenisimas. Hay buen servicio, un lugar agradable y con buen ambiente.Hoy revis칠 el men칰 y os precios y platos est치n bien.El pur칠 de pap치 no es el fuerte.Salm칩n... Bien","Normalmente vengo por calidad que son buenisimas. Hay buen servicio, un lugar agradable y con buen ambiente.Hoy revis칠 el men칰 y os precios y platos est치n bien.El pur칠 de pap치 no es el fuerte.Salm칩n... Bien"
158,"Bar, Pub",positive,"Fui all칤 con un par de amigos m치s j칩venes, mucho m치s j칩venes. Lo eleg칤 y me alegro de que me dieron a conocer. Trajo recuerdos de un pub que frecuentan mientras en la universidad y donde aprend칤 a beber cerveza de verdad. Las hamburguesas son excepcionales. Una buena selecci칩n de cervezas y artesan칤as, no muchas, pero las adecuadas de acuerdo a mi gusto. Prefiero mis favoritos en su propia casa de hecho. El servicio era bueno, aunque la gente era de luz mientras estuvimos all칤. M칰sica agradable, no demasiado alto, as칤 que pudimos disfrutar de nuestra conversaci칩n. Una muy buena relaci칩n calidad-precio en general.","Fui all칤 con un par de amigos m치s j칩venes, mucho m치s j칩venes. Lo eleg칤 y me alegro de que me dieron a conocer. Trajo recuerdos de un pub que frecuentan mientras en la universidad y donde aprend칤 a beber cerveza de verdad. Las hamburguesas son excepcionales. Una buena selecci칩n de cervezas y artesan칤as, no muchas, pero las adecuadas de acuerdo a mi gusto. Prefiero mis favoritos en su propia casa de hecho. El servicio era bueno, aunque la gente era de luz mientras estuvimos all칤. M칰sica agradable, no demasiado alto, as칤 que pudimos disfrutar de nuestra conversaci칩n. Una muy buena relaci칩n calidad-precio en general."
159,"Latina, Centroamericana, Costarricense",positive,La mejor comida del pueblo en cuanto a tradicional. Excelente servicio y buena comida! Adrmas de precios super accesible,La mejor comida del pueblo en cuanto a tradicional. Excelente servicio y buena comida! Adrmas de precios super accesible
160,De la India,positive,"La comida es deliciosa y  el servicio es muy bueno. Buena relaci칩n calidad-precio. Para los amantes de la comida india, 춰recomendad칤simo!","La comida es deliciosa y  el servicio es muy bueno. Buena relaci칩n calidad-precio. Para los amantes de la comida india, 춰recomendad칤simo!"
