,Tipo_Comida,Calificacion_Comentario,Comentario,Comentario corregido
240,"Italiana, Pizzer칤a",positive,"Una pizzer칤a justo c치lida y agradable en una zona muy cara y elegante. La pizza es muy buena, y todos tienen un precio muy razonable. Me gusta mucho este lugar y tienen algunos descuentos y/o ofertas como lunes 2 x 1.Bebidas naturales muy buena pero tambi칠n Dios vino y cerveza.","Una pizzer칤a justo c치lida y agradable en una zona muy cara y elegante. La pizza es muy buena, y todos tienen un precio muy razonable. Me gusta mucho este lugar y tienen algunos descuentos y/o ofertas como lunes 2 x 1.Bebidas naturales muy buena pero tambi칠n Dios vino y cerveza."
241,"Parrilla, Fusi칩n",positive,Muy buena opci칩n de alimentaci칩n en Jac칩. En un centro gastron칩mico que invita a seleccionar lo mejor de la comida internacional. Muy buena atenci칩n y comida alternativa para todos,Muy buena opci칩n de alimentaci칩n en Jac칩. En un centro gastron칩mico que invita a seleccionar lo mejor de la comida internacional. Muy buena atenci칩n y comida alternativa para todos
242,De la India,positive,Siempre que vamos a comer comida hind칰 vamos a 506 y nunca hemos tenido quejas. Mantienen siempre el excelente est치ndar de c치lidad. Todo lo que hemos comido siempre nos ha gustado y los meseros son super amables.,Siempre que vamos a comer comida hind칰 vamos a 506 y nunca hemos tenido quejas. Mantienen siempre el excelente est치ndar de c치lidad. Todo lo que hemos comido siempre nos ha gustado y los meseros son super amables.
243,Pizzer칤a,positive,"Es un buen lugar para visitar con tus amigos, pizza por metros, extra침o, pero bueno, tambi칠n tienen muchas otras cosas que son buenas y sabrosas.","Es un buen lugar para visitar con tus amigos, pizza por metros, extra침o, pero bueno, tambi칠n tienen muchas otras cosas que son buenas y sabrosas."
244,"Parrilla, Fusi칩n",positive,"Graffiti en una palabra, incre칤ble. La mezcla ecl칠ctica de graffitis ilustraciones y fotograf칤as enmarcadas de talentos locales hace que el ambiente acogedor e interesante para tomar mientras cena. El servicio es excelente, amable, servicial y incre칤blemente informados acerca de la comida. La comida es excelente. La mejor comida que he tenido en Jaco, sin duda. Cada plato es poner juntos con tanta atenci칩n al detalle y el cuidado que casi no te sientes mal comer. Tambi칠n tienen creativos c칩cteles y deliciosos como un martini de albahaca de pepino que es para morirse! Perfecto para una cena 칤ntima entre amigos o una celebraci칩n grande de grupo. Si est치s en Jaco tienes que probar este lugar!!!","Graffiti en una palabra, incre칤ble. La mezcla ecl칠ctica de graffitis ilustraciones y fotograf칤as enmarcadas de talentos locales hace que el ambiente acogedor e interesante para tomar mientras cena. El servicio es excelente, amable, servicial y incre칤blemente informados acerca de la comida. La comida es excelente. La mejor comida que he tenido en Jaco, sin duda. Cada plato es poner juntos con tanta atenci칩n al detalle y el cuidado que casi no te sientes mal comer. Tambi칠n tienen creativos c칩cteles y deliciosos como un martini de albahaca de pepino que es para morirse! Perfecto para una cena 칤ntima entre amigos o una celebraci칩n grande de grupo. Si est치s en Jaco tienes que probar este lugar!!!"
245,"Mariscos, Centroamericana, Internacional, Contempor치nea",positive,"Ten칤a una fant치stica cena de langosta que no estaba en el men칰. Sugerido por el camarero que estaba en la cima, con un gran servicio. Todo era genial. Est치bamos llenos pero hizo un postre para compartir habitaci칩n. No puedo esperar a volver! !","Ten칤a una fant치stica cena de langosta que no estaba en el men칰. Sugerido por el camarero que estaba en la cima, con un gran servicio. Todo era genial. Est치bamos llenos pero hizo un postre para compartir habitaci칩n. No puedo esperar a volver! !"
246,"Mexicana, Pizzer칤a, Mariscos, Costarricense, Saludable",,"Hab칤a un pescado de entrante. Estaban fuera de Mahi Mahi :(un mont칩n de gente le gusta este sitio, as칤 que estoy seguro de que es bueno. Mi comentario es para mi una experiencia de cena aqu칤. Todo el mundo estaba encantado con su comida pero nadie estaba impresionado.","Hab칤a un pescado de entrante. Estaban fuera de Mahi Mahi :(un mont칩n de gente le gusta este sitio, as칤 que estoy seguro de que es bueno. Mi comentario es para mi una experiencia de cena aqu칤. Todo el mundo estaba encantado con su comida pero nadie estaba impresionado."
247,"Estadounidense, Europea, Brit치nica, Australiana, Costarricense, Bar, Comida r치pida",positive,"Muy buena la comida, las hamburguesas son muy ricas y la atenci칩n de Cristof excelente, muy bien ubicado","Muy buena la comida, las hamburguesas son muy ricas y la atenci칩n de Cristof excelente, muy bien ubicado"
248,"Italiana, Pizzer칤a",positive,"쮺칩mo es esto no clasificado superior? Agradable, personal muy trabajador. fideos caseros, pan, corteza, salsa ... calidad de la comida es fabulosa. Nos encant칩. Tuve ensalada de at칰n-- at칰n era abundante y deliciosa. A los ni침os y a mi marido ten칤a pizzas y los espaguetis y comimos cada bocado. Era nuestra 칰ltima comida de Costa Rica en el camino hacia el aeropuerto. Gran final para pasar unas divertidas vacaciones.","쮺칩mo es esto no clasificado superior? Agradable, personal muy trabajador. fideos caseros, pan, corteza, salsa ... calidad de la comida es fabulosa. Nos encant칩. Tuve ensalada de at칰n-- at칰n era abundante y deliciosa. A los ni침os y a mi marido ten칤a pizzas y los espaguetis y comimos cada bocado. Era nuestra 칰ltima comida de Costa Rica en el camino hacia el aeropuerto. Gran final para pasar unas divertidas vacaciones."
249,"Mediterr치nea, Del Medio Oriente",positive,"La comida es fresca y la atenci칩n es excelente.Esta bien ubicado, cerca de lugares de interes tur칤stico.La frescura de sus platos y la asesoria a la hora de elegir los platos es un factor importante para volver y recomendarlo a muchas personas.","La comida es fresca y la atenci칩n es excelente.Esta bien ubicado, cerca de lugares de interes tur칤stico.La frescura de sus platos y la asesoria a la hora de elegir los platos es un factor importante para volver y recomendarlo a muchas personas."
250,"Japonesa, Sushi, Asi치tica",positive,Encontramos este restaurante por encima de la cafeter칤a empujado a volver en un centro comercial. Nos dieron una c치lida bienvenida y r치pidamente tomar asiento. Tienen un gran men칰 de rollos y el sushi estaba delicioso.Art칤culos eran bastante razonables. Volver칤amos.,Encontramos este restaurante por encima de la cafeter칤a empujado a volver en un centro comercial. Nos dieron una c치lida bienvenida y r치pidamente tomar asiento. Tienen un gran men칰 de rollos y el sushi estaba delicioso.Art칤culos eran bastante razonables. Volver칤amos.
251,"Italiana, Mediterr치nea, Europea",positive,"Incre칤ble la Corvina de Tony, al horno, lomo de Corvina especial de primera, con vino blanco, mantequilla y especias; acompa침ada con pasta al dente o vegetales tiernos y frescos; verdaderamente una delicia, para recordar.Por otra parte, el servicio excelente, expedito, respetuoso, en un ambiente c치lido y agradable.","Incre칤ble la Corvina de Tony, al horno, lomo de Corvina especial de primera, con vino blanco, mantequilla y especias; acompa침ada con pasta al dente o vegetales tiernos y frescos; verdaderamente una delicia, para recordar.Por otra parte, el servicio excelente, expedito, respetuoso, en un ambiente c치lido y agradable."
252,"Japonesa, Sushi, Asi치tica, Bar, Pub, Saludable",positive,El ambiente es muy bonito para mi es uno de los mejores lugares donde se come excelentes sushi   Y el precio muy bueno  porque la calidad es muy buena lo recomiendo,El ambiente es muy bonito para mi es uno de los mejores lugares donde se come excelentes sushi   Y el precio muy bueno  porque la calidad es muy buena lo recomiendo
253,"Estadounidense, Bar, Saludable, Centroamericana, Costarricense, Internacional",positive,Este lugar era tan buena que fuimos dos veces esta semana durante nuestras vacaciones para el desayuno. Prueba el muy tostadas francesas y Berry cualquiera de las sart칠n. Son incre칤bles. Impresionante decoraci칩n personal y as칤!,Este lugar era tan buena que fuimos dos veces esta semana durante nuestras vacaciones para el desayuno. Prueba el muy tostadas francesas y Berry cualquiera de las sart칠n. Son incre칤bles. Impresionante decoraci칩n personal y as칤!
254,"Italiana, Alemana, Mariscos, Asi치tica, Costarricense",positive,"Innov con una propuesta de diversas cocinas fusi칩n: mexicano, mariscos, italiano, alem치n, japones ,con gran 칠xito. Reune gente cool y es tanto gastron칩mico como de entretenimiento de jueves a s치bado.Pueden ir toda la familia hasta con sus perro. Ahora el etapa 2 abren Carnes tipo bbq , indio , pizzas , escandinavo y viene con m맙....Cierran muy temprano viernes y s치bado 10 p.m Siganos en fb o instagram @tavolorossocr.","Innov con una propuesta de diversas cocinas fusi칩n: mexicano, mariscos, italiano, alem치n, japones ,con gran 칠xito. Reune gente cool y es tanto gastron칩mico como de entretenimiento de jueves a s치bado.Pueden ir toda la familia hasta con sus perro. Ahora el etapa 2 abren Carnes tipo bbq , indio , pizzas , escandinavo y viene con m맙....Cierran muy temprano viernes y s치bado 10 p.m "
255,"Bar, Pub",positive,"Este es un peque침o restaurante bar (o lo que sea), donde la cerveza es un punto de artesan칤a, as칤 como buena comida. No es el m치s barato disponible, pero sin duda un lugar de gran valor.","Este es un peque침o restaurante bar (o lo que sea), donde la cerveza es un punto de artesan칤a, as칤 como buena comida. No es el m치s barato disponible, pero sin duda un lugar de gran valor."
256,"Mariscos, Centroamericana, Internacional, Contempor치nea",positive,"Este es, de lejos, la mejor comida que se puede encontrar en Jaco. Los chefs y la calidad de la comida es de primera categor칤a. Todo fresco y ingredientes de procedencia local. Ver Bryan que le dar치 las mejores recomendaciones y ofertas especiales! Definitivamente regresaremos.","Este es, de lejos, la mejor comida que se puede encontrar en Jaco. Los chefs y la calidad de la comida es de primera categor칤a. Todo fresco y ingredientes de procedencia local. Ver Bryan que le dar치 las mejores recomendaciones y ofertas especiales! Definitivamente regresaremos."
257,"Mexicana, Pizzer칤a, Mariscos, Costarricense, Saludable",positive,"Nuestro grupo pedimos 4 platos diferentes, y todo estaba delicioso. Me dieron el mahi bowl de Poke y el pescado era braseado perfectamente. Generalmente no se ocupan de jud칤as pintas, pero sus jud칤as pintas y guacamole eran deliciosos que pedimos m치s. Mi marido tres tacos diferentes y que eran todos muy buenos. El personal era amable y servicial. Situado en el centro de la ciudad, as칤 que fue un agradable paseo a pie y desde nuestro hotel.","Nuestro grupo pedimos 4 platos diferentes, y todo estaba delicioso. Me dieron el mahi bowl de Poke y el pescado era braseado perfectamente. Generalmente no se ocupan de jud칤as pintas, pero sus jud칤as pintas y guacamole eran deliciosos que pedimos m치s. Mi marido tres tacos diferentes y que eran todos muy buenos. El personal era amable y servicial. Situado en el centro de la ciudad, as칤 que fue un agradable paseo a pie y desde nuestro hotel."
258,"Pub, Sudamericana, Costarricense",positive,"Este lugar es una sorpresa realmente agradable, en la carretera entre Tamarindo y Liberia. La comida es muy buena, tienen porciones grandes, el precio es excelente para la comida tonta que recibes, y el servicio es incre칤ble. El mejor aspecto de este lugar es que est치 abierto hasta tarde, siempre con la mejor comida y servicio.","Este lugar es una sorpresa realmente agradable, en la carretera entre Tamarindo y Liberia. La comida es muy buena, tienen porciones grandes, el precio es excelente para la comida tonta que recibes, y el servicio es incre칤ble. El mejor aspecto de este lugar es que est치 abierto hasta tarde, siempre con la mejor comida y servicio."
259,"Costarricense, Estadounidense, Sudamericana, Centroamericana",positive,"Muy buena comida y servicio. El plato ""tradicional"" muy abundante, buena mezcla. 춰Una buena parada para almorzar si te diriges al sur de Jose's Croc River Tour!","Muy buena comida y servicio. El plato ""tradicional"" muy abundante, buena mezcla. 춰Una buena parada para almorzar si te diriges al sur de Jose's Croc River Tour!"
260,Pizzer칤a,positive,The best Pizza in jaco  y en costa rica  esta en el centro a jaco su servicio excelente  lo recomiendo  muy simpaticos son todos ahi ...,The best Pizza in jaco  y en costa rica  esta en el centro a jaco su servicio excelente  lo recomiendo  muy simpaticos son todos ahi ...
261,"Latina, Mariscos",positive,"Empezar칠 de atr치s para adelante.춰Tiene que probar el postre de flan de coco! Es el MEJOR que pueden encontrar en San Jos칠. Este postre est치 perfectamente horneado y tiene el nivel de dulce perfecto, se los dice alguien que no es amante del coco, pero este flan es otro nivel.Los platos fuertes son deliciosos, pero mi recomendaci칩n es que si van con amigos pidan varias bocas y as칤 prueban de todo un poco.La sangr칤a tiene muy buen sabor, de nuevo, si van con amigos vayan por el pichel, f치cil salen 5-6 copas.Por 칰ltimo pero no menos importante, el servicio es excelente, son s칰per amables, atentos y se preocupan por que uno est칠 a gusto.Si les gusta algo acogedor y del mar 춰Tienen que ir!","Empezar칠 de atr치s para adelante.춰Tiene que probar el postre de flan de coco! Es el MEJOR que pueden encontrar en San Jos칠. Este postre est치 perfectamente horneado y tiene el nivel de dulce perfecto, se los dice alguien que no es amante del coco, pero este flan es otro nivel.Los platos fuertes son deliciosos, pero mi recomendaci칩n es que si van con amigos pidan varias bocas y as칤 prueban de todo un poco.La sangr칤a tiene muy buen sabor, de nuevo, si van con amigos vayan por el pichel, f치cil salen 5-6 copas.Por 칰ltimo pero no menos importante, el servicio es excelente, son s칰per amables, atentos y se preocupan por que uno est칠 a gusto.Si les gusta algo acogedor y del mar 춰Tienen que ir!"
262,"Estadounidense, Centroamericana, Costarricense, Caf칠",positive,"Acabo de abandonar el amanecer, no puedo gracias Dan & Jessina impresionante para una cena de Acci칩n de Gracias, es mi 3 a침os asistiendo a Acci칩n con m치s de 50 personas. dicen que gracias a sus clientes y es gratis, es lo m치s parecido a estar en casa con mi familia. Es el pulso de Jaco, adorado por muchas personas, lo llamamos el lugar de reuni칩n. 춰CHAPEAU!","Acabo de abandonar el amanecer, no puedo gracias Dan & Jessina impresionante para una cena de Acci칩n de Gracias, es mi 3 a침os asistiendo a Acci칩n con m치s de 50 personas. dicen que gracias a sus clientes y es gratis, es lo m치s parecido a estar en casa con mi familia. Es el pulso de Jaco, adorado por muchas personas, lo llamamos el lugar de reuni칩n. 춰CHAPEAU!"
263,"Bar, Estadounidense",positive,"El lugar es muy agradable, buena m칰sica y partidos varias TV. Tiene muchas opciones en el men칰 y el personal est치 dispuesto hacer las variaciones a los platos para complacer a los clientes.","El lugar es muy agradable, buena m칰sica y partidos varias TV. Tiene muchas opciones en el men칰 y el personal est치 dispuesto hacer las variaciones a los platos para complacer a los clientes."
264,"Latina, Mariscos, Centroamericana, Costarricense",positive,"Atenci칩n esmerada en el servicio y buenas comidas. Especial para encuentros donde conversar es parte importante, parte del pasar bien.","Atenci칩n esmerada en el servicio y buenas comidas. Especial para encuentros donde conversar es parte importante, parte del pasar bien."
265,"Comida de calle, Italiana, Japonesa, Estadounidense, Bar, Caf칠",positive,El lugar tiene varios restaurantes y un bar. Bonito ambiente para pasar una tarde de sangrias. El restaurante a 2 msnos de hamburguesas es excelente.,El lugar tiene varios restaurantes y un bar. Bonito ambiente para pasar una tarde de sangrias. El restaurante a 2 msnos de hamburguesas es excelente.
266,"Internacional, Sudamericana, Costarricense",positive,"Uno de los Restaurantes dentro de Punta Leona, con un servicio de primera, los meseros son sumamente atentos y el bufette para desayunar, de los m치s completos y ricos que he comido en mucho tiempo. Hay de todo! y lo m치s espectacular para mi (como turista) es que hay monos al asecho, jajaja, te paras de tu mesa y los meseros corren para espantarlos y que no roben los sobres de az칰car, jaja. Ya ahora hay una malla que sigue permitiedo contemplar la ex칩tica vegetaci칩n que rodea al restaurant y que le dificulta la entrada a los monos. Pero bueno, que rico desayuno tuve ahi y los precios muy justos.","Uno de los Restaurantes dentro de Punta Leona, con un servicio de primera, los meseros son sumamente atentos y el bufette para desayunar, de los m치s completos y ricos que he comido en mucho tiempo. Hay de todo! y lo m치s espectacular para mi (como turista) es que hay monos al asecho, jajaja, te paras de tu mesa y los meseros corren para espantarlos y que no roben los sobres de az칰car, jaja. Ya ahora hay una malla que sigue permitiedo contemplar la ex칩tica vegetaci칩n que rodea al restaurant y que le dificulta la entrada a los monos. Pero bueno, que rico desayuno tuve ahi y los precios muy justos."
267,"Italiana, Pizzer칤a",positive,"Los platos ejecutivos muy buenos, ensalada, pizza personal a elegir el sabor, refresco y postre por 5900,00 todo fresco y muy rico. El servicio es muy cordial y atento.","Los platos ejecutivos muy buenos, ensalada, pizza personal a elegir el sabor, refresco y postre por 5900,00 todo fresco y muy rico. El servicio es muy cordial y atento."
268,"Mexicana, Comida r치pida, Latina, Centroamericana",positive,"los tacos aqui son ricos, no son tan caros. vale la pena probarlos al menos una vez! la gente es amable en caja, pero el se침or que preparo mi enchilada, fue bastante rudo.","los tacos aqui son ricos, no son tan caros. vale la pena probarlos al menos una vez! la gente es amable en caja, pero el se침or que preparo mi enchilada, fue bastante rudo."
269,N/E,positive,Todo riqu칤simo ! Y los viernes solo mariscos !!! Los mejores !!! Con una ubicaci칩n demasiado c칠ntrica y los mejores precios,Todo riqu칤simo ! Y los viernes solo mariscos !!! Los mejores !!! Con una ubicaci칩n demasiado c칠ntrica y los mejores precios
270,"Churrasquer칤a, Latina, Centroamericana, Costarricense",positive,"Es delicioso, empezando por los frijolitos! Las carnes, mi favorito lomito a la pimienta y filet mignon, 100% recomendado. Es un lugar de atenci칩n r치pida y amable!","Es delicioso, empezando por los frijolitos! Las carnes, mi favorito lomito a la pimienta y filet mignon, 100% recomendado. Es un lugar de atenci칩n r치pida y amable!"
271,"Fusi칩n, Gastropub, Comida de calle, Mariscos, Asi치tica, Coreana, Pub",positive,"Muy buen servicio y excelente comida, comimos mariscos y fue excelente decisi칩n, sobre todo fondo de mariscos","Muy buen servicio y excelente comida, comimos mariscos y fue excelente decisi칩n, sobre todo fondo de mariscos"
272,"Churrasquer칤a, Mariscos",positive,"Nos visita f치brica por lo menos dos veces al mes. Yo ya no necesitan el men칰. hemos tenido hoy, ensalada de Ceasar, queso provolone, langosta y pato. opciones excelentes. Nuestro camarero today Jaison. El servicio tambi칠n era genial.","Nos visita f치brica por lo menos dos veces al mes. Yo ya no necesitan el men칰. hemos tenido hoy, ensalada de Ceasar, queso provolone, langosta y pato. opciones excelentes. Nuestro camarero today Jaison. El servicio tambi칠n era genial."
273,"Latina, Centroamericana, Costarricense",positive,Lo m치s aut칠ntico posible. La verdadera experiencia Soda para comida de Tico. Siempre lleno de gente. No ir con hambre. Mejor $5 comida en la ciudad.,Lo m치s aut칠ntico posible. La verdadera experiencia Soda para comida de Tico. Siempre lleno de gente. No ir con hambre. Mejor $5 comida en la ciudad.
274,"Costarricense, Mariscos, Internacional",positive,Excelente servicio y calidad en la comida y me reencantan los ostiones frescos y la Langosta es excelente.,Excelente servicio y calidad en la comida y me reencantan los ostiones frescos y la Langosta es excelente.
275,"Italiana, Mediterr치nea, Europea",positive,"Un lugar agradable para disfrutar de comida Italiana. La comida es muy rica, servicio excelente. Precio calidad muy bueno.","Un lugar agradable para disfrutar de comida Italiana. La comida es muy rica, servicio excelente. Precio calidad muy bueno."
276,"Japonesa, Sushi, Asi치tica",positive,Yo com칤 agradable en Sakura. Tienen buen men칰 y comida de buena calidad y el servicio es muy agradable. Recomiendo encarecidamente.,Yo com칤 agradable en Sakura. Tienen buen men칰 y comida de buena calidad y el servicio es muy agradable. Recomiendo encarecidamente.
277,"Japonesa, Sushi, Asi치tica, Saludable",positive,"Sushi de Nau es ir a la segura. Sushi fresco, de buen sabor, recien preparado. El ambiente es agradable, el servicio es bueno. Hay que preguntar por los especiales, siempre hay uno o dos rollos especiales a la semana. El men칰 ha variado un poco, prob칠 el nuevo rollo de coco, con una salsa cremosa muy rica y de proteina camarones. (2do rollo) El primer rollo es el nau especial de salm칩n, mi favorito. Los precios son comodos y de acuerdo a las porciones y calidad recibida. Muy recomendado! #Almuerzo #Lunch #Sushi #Mariscos #NauEspecial #ticos #CostaRica@intercontinentalcostarica","Sushi de Nau es ir a la segura. Sushi fresco, de buen sabor, recien preparado. El ambiente es agradable, el servicio es bueno. Hay que preguntar por los especiales, siempre hay uno o dos rollos especiales a la semana. El men칰 ha variado un poco, prob칠 el nuevo rollo de coco, con una salsa cremosa muy rica y de proteina camarones. (2do rollo) El primer rollo es el nau especial de salm칩n, mi favorito. Los precios son comodos y de acuerdo a las porciones y calidad recibida. Muy recomendado! #Almuerzo #Lunch #Sushi #Mariscos #NauEspecial #ticos #CostaRica@intercontinentalcostarica"
278,"Latina, Bar, Centroamericana, Costarricense",positive,"El lugar es r칰stico, pero muy bonito, la atenci칩n me pareci칩 apropiada y el servicio r치pido, la calidad precio servicio es muy buena, y me parece que es un lugar adecuado para comer comida t칤pica, buena opci칩n de bebidas con y sin alcohol. Regresar칤a pronto!!!!","El lugar es r칰stico, pero muy bonito, la atenci칩n me pareci칩 apropiada y el servicio r치pido, la calidad precio servicio es muy buena, y me parece que es un lugar adecuado para comer comida t칤pica, buena opci칩n de bebidas con y sin alcohol. Regresar칤a pronto!!!!"
279,"Japonesa, Sushi, Asi치tica, Bar, Pub, Saludable",positive,"Han estado aqu칤 varias veces, la calidad es estable y el sushi es probablemente el mejor que he tenido no s칩lo en Jaco pero en general, nos encanta el ambiente de fiesta que tienen y las bebidas son grandes y barato, tienen promociones cada d칤a. Sin duda un lugar para visitar.","Han estado aqu칤 varias veces, la calidad es estable y el sushi es probablemente el mejor que he tenido no s칩lo en Jaco pero en general, nos encanta el ambiente de fiesta que tienen y las bebidas son grandes y barato, tienen promociones cada d칤a. Sin duda un lugar para visitar."
280,"Italiana, Europea, Toscana, Romana, De Lacio, Siciliana, Del centro italiano, Del sur italiano",positive,"Tiene un muy lindo y familiar ambiente, la gastronomia es excelente y poseen una cava de vinos de alta calidad. Cada vez que regrese a San Jos칠, cenar칠 en este lugar.","Tiene un muy lindo y familiar ambiente, la gastronomia es excelente y poseen una cava de vinos de alta calidad. Cada vez que regrese a San Jos칠, cenar칠 en este lugar."
281,Mariscos,positive,"El d칤a de ayer visitamos el restaurante y pedimos la Sopa de Mariscos Puerto Viejo! Simplemente deliciosa, no he visto esta receta en otros restaurantes me parece muy original y con un sabor 칰nico, no es picante pero tiene el sabor del chile paname침o. El otro plato fue el Risotto de Salm칩n al Verdi y tambi칠n estaba delicioso de verdad recomiendo estos dos platos!","El d칤a de ayer visitamos el restaurante y pedimos la Sopa de Mariscos Puerto Viejo! Simplemente deliciosa, no he visto esta receta en otros restaurantes me parece muy original y con un sabor 칰nico, no es picante pero tiene el sabor del chile paname침o. El otro plato fue el Risotto de Salm칩n al Verdi y tambi칠n estaba delicioso de verdad recomiendo estos dos platos!"
