,Tipo_Comida,Calificacion,Comentario,Calificacion_Comentario
0,"Parrillada, Churrasquería",negative,llevo comiendo en este lugar desde que estaba ubicado en barrio turnón pero desde que se pasaron al local en tibás ha ido de mal en peor no me molesta pagar caro por algo bueno pero aquí la relación calidadprecio está muy mal espero que mejore porque sino va a desaparecer pronto ya qué hay mucha competencia actualmente la atención del personal es buena pero la comida nada que ver,2
1,"Parrillada, Churrasquería",negative,el día de ayer fui a festejar el cumpleaños de mi esposo eramos los únicos en el restaurante y aun así duraron demasiado en atendernos luego entre los acompañamientos pedimos papa asada resulta que le tiran un chorrito de natilla como de decoración por lo cual llamamos al salonero para que nos trajera mas y se fue a hablar por teléfono a los 10 min de esperar me levante a pedírsela nuevamente me dijo nuevamente que ya me la llevaban luego de eso como 10 min mas tarde salio otro salonero de la cocina por lo cual me tuve que levantar nuevamente a pedirla luego de unos minutos me llevaron aproximadamente una onza en una tacita por la cual me cobraron 1300 colones ademas de la mala atención siento que ha bajado muchísimo la calidad costillas re cocinadas secas y sin suficiente salsa ademas de precios excesivos por años desde que estaban junto al simon bolivar fueron uno de mis lugares preferidos siempre con precios altos pero lo valían ahora por 68900 5 costillas secas 4 gaseosas 1 orden de papas y 1 onz de natilla por la que te tienes que levantar 3 veces me parece excesivo,1
2,De la India,positive,lindo restaurante con variados platillos y bebidas presentación de los platos muy bueno bebidas grandes,4
3,De la India,negative,es una barbaridad que anuncien almuerzos ejecutivos a un precio que no incluye nada de lo que tiene un almuerzo ejecutivo normal ejemplo anuncian 3950 colones por la carne más barata y arroz si se quiere refresco sube otra carne sube ensalada sube y ni que decir de la entrada mejor dar el precio real con lo que tiene un almuerzo real lástima porque hay buena atención y se come rico,1
4,De la India,positive,fuimos a almorzar con la familia y todos quedamos encantados con la deliciosa comida especialmente porque cuando de comer sin gluten se trata es sumamente difícil encontrar un lugar adecuado además cocinan sin aceite de soya y eso también es difícil de encontrar para los que somos alérgicos a la soya la velada estuvo muy agradable y desde ya estamos pensando regresar para disfrutar nuevamente de esta deliciosa experiencia,5
5,De la India,positive,muy buena atención de todos los que trabajan allí excelentes recomendaciones calidad de la comida muy buena y el lugar es tranquilo,5
6,De la India,positive,hemos ido ya varias veces la comida siempre deliciosa y una excelente atención celebré mi cumpleaños aquí y hasta me llevaron un postre delicioso,5
7,De la India,positive,excelente atención y comida deliciosa además de pequeños detalles como una cortesía de uno de sus de platillos era un tipo de pan hecho con lentejas y otros ingredientes no me recuerdo su nombre son detalles que llenan de satisfacción y ganas de visitarlos nuevamente,5
8,De la India,positive,el lugar pequeño pero bien decorado ambiente agradable la comida es muy sabrosa sabores accesibles y nuevos para quien no conoce de la gastronomía quizás les falta un poco de guía para las personas que no conocen del menú y en general la gastronomía de la india el servicio estuvo muy bien los precios accesiblesnormales el punto alto del lugar es que cuentan con un menú inmensamente variado para todos los gustos,4
9,De la India,positive,mi familia y yo 4 adultos como comida india pero nos encantó los platos que se sirven aquí de hecho nos eligieron por unanimidad volver a este lugar en lugar de explorar otras opciones elegantes y seductoras están equipadas de la cena la segunda noche el servicio era agradable principalmente fue la comida picante y sabrosa sin tonterías incluso el pan era sorprendentemente bueno y cuán emocionante será buena relación calidadprecio me pareció que por el precio,5
13,Mariscos,positive,fuimos un domingo tan pronto como el restaurante abrió sus puertas sorprendentemente abrieron la puerta a pocos minutos temprano y nos dejó entrar nos sentábamos afuera mis hijos tenían las tiras de pollo y mi marido y yo compartimos las el camarón y cajún patatas fritas todo estaba delicioso volveremos,5
14,"Española, Mediterránea",positive,he ido varias veces y estoy seguro de querer volver un menú que le recuerda cualquier almuerzo con vista a la giralda hoy tuve el placer de degustar una paella de mariscos con mi familia además de un cochinillo asado y debo decir que era simplemente espectacular la porción de paella dice ser para 10 pero alcanza para más comensales el cochinillo a la altura de los mejores lugares de españatodos quedamos satisfechos y contentos de la elección,5
15,"Mexicana, Latina",positive,durante nuestra visita de trabajo en la academia nacional de bomberos de costa rica decidimos alojarnos en el hotel hyatt ubicado en la plaza momentum por las noches buscamos opciones para cenar siendo la más destacada experiencia la vivida en este restaurant de comida mexicana fue tan grata la experiencia que terminamos cenando ahi durante tres noches,5
16,"Mexicana, Latina",negative,comida con poco sabor y de baja calidad para el precio cobrado pedimos costillas de cerdo y tenían una mínima cantidad de carne casi todo era grasa además de tener la textura del cerdo recocinado parecían añejas la atención y las bebidas estuvieron bien,2
17,"Churrasquería, Latina, Argentina",negative,platillo de camarones a 17000 colones 17000 30 dólares camaroncitos de bolsa como en la princesa marina mejor comprarlos en oceánicanos trajeron un corte de carne incomible y con la pasta de equivocaron vean el tamaño,2
18,"Churrasquería, Latina, Argentina",negative,la comida ea en realidad muy estándar más bien comercial en nada se asemeja al estilo argentino pero lo peor de la experiencia es el pésimo servicio que uno recibe para nada recomendado,1
19,"Churrasquería, Latina, Argentina",negative,en general cuando recibes el plato que ordenasteel plato se mira vacío la ensalada viene en un plato aparte y la ensalada es igual de corriente a la que preparo en casa lechuga con tomate y un poco de zanahoria los refrescos igualmente super corrientes el plato promedio cuesta 15 mil colonespero en mi caso no veo un gran sabor que haga valer el precio la atención del mesero también escasa diría que apenas cumple en resumen primera y última vez que vengo prefiero cocinar en casa cualquier corte de la carniceria de mi barrio,1
20,"Churrasquería, Latina, Argentina",positive,he visitado este restaurante unas 3 veces el servicio es bueno y en dos ocasiones la comida estaba excelente,3
21,"Churrasquería, Latina, Argentina",negative,el espacio es muy reducido y tardan demasiado en servir el plato fuerte los meseros son muy despreocupados de la atención a los clientes,2
22,"Churrasquería, Latina, Argentina",positive,fui a el novillo en curridabat no el de santa ana durante 2014 marzo para cenar con un amigo llegamos un poco tarde por la noche 9 pm y tenía un extraordinario servicio todavíajusto en la entrada nos recibió señora que proporciona las mesas disponibles y inmediatamente nos dieron una camarera que nos atendió la música estaba muy bien el entorno también era bonito con luces bajas y no hay mucho ruido incluso si había unos cuantos clientes en el lugar el lugar tiene mucha decoración de alguna manera estilo retro pero muy agradable hay una segunda ubicación de la planta que está reservado para eventos especiales y puede albergar a un máximo de 50 personas fácilmente según el personal de personalpara beber tuvimos una botella de vino tenían algunas ofertas especiales pero desafortunadamente no tenían una carta de vinos o tarjeta bien presentada sólo algunos cuadros con carta de vinos que me dieron no es el más elegante manera de mostrar su cliente es el vino opciones de todas maneras no hay nada malo la camarera una feria conocimiento de la selección y fue capaz de responder mis preguntastienen una buena variedad de carnes cortes diferentes y todas ellas muy buenas pero claro si eres una carne amante este es tu lugar pedimos unos 300 gr lomito 34 hecha y 400 gr tbone no show en el menú ambas great normalmente no comas mucho carne pero tengo que decir que fue una increíble selección mi amigo es un amante de la carne y mencionó que ambos deliciososno pedimos entradas pero ofrecen pan con 3 cosas chimicurry el original crema de queso y lo que llamamos en costa rica pico de gallo que son tomates picados con algunas especias y cebollas a menudo llamado chimicurry también no tuvimos postre o como estábamos muy muy lleno pero conseguimos la oferta del personala las 1000 el cerrado el lugar pero nunca nos sentimos como me daban patadas en su lugar el personal era muy respectfull y esperaron pacientemente para terminar si paga con la tarjeta credomatic te dan 30 de descuento que también es genial el registro si es aún como es una oferta que va hasta 2014 julio en cuanto a entender pero no me hagáis caso mejor preguntarhay tranquilos un buen espacio de aparcamiento compartida con otros restaurantes también sólo tenía un grave perjuicio y no puedo caminar bien pero el espacio es lo suficientemente bueno como para gestionar no estoy seguro de si una persona en una silla de ruedas podría ir a la 2ª planta pero seguramente el 1â° piso está bienve y disfruta al final pagamos unos 35000 cambiar a colones no con la discaoount aplican menos de 100 no está mal para un lugar sitdown,4
23,"Italiana, Napolitana",positive,me gusta participar de las catas porque son muy amenas y se aprende de verdad alfredo siempre atento y el chef doménico explicando siempre la historia y la receta de los platillos tradicionales italianos se consigue vinos excelentes a muy buenos precios,5
24,Internacional,positive,el plato básico es bueno y uno puede pedir una gran variedad de pescado pollo o carne lo más importante es que todos los complementos se sirven de una barra adicional que puedes comer lo que quieras y con una gran variedad lo básico es muy bueno,4
25,Internacional,negative,a parte de que se necesita un manual de instrucciones para pedir la comida todo lo que pedimos estaba malísimo el pescado pasado mi refresco traía papel aluminio y los burritos o mas bien wrap de gallo pinto incomibles no volvería,1
26,"Italiana, Pizzería",negative,es una trampa mortal riesgo de contagio de covid la encargada cerró las ventanas y pusieron el aire acondicionado dejando a 20 personas sin flujo de aire a pesar de que le pedimos que lo abriera por seguridad de todos dio media vuelta y se fue la comida no es tan rica como para arriesgarse tanto en especial porque no hay alcohol en gel ni toman la temperatura uno los quiere ayudar pero ellos no cuidan la salud de sus clientes,1
27,"Italiana, Pizzería",negative,otras veces he pedido pizza express en este restaurante y no había estado tan decepcionada ☹️ la pizza era mediana para el tamaño me pareció muy pequeña y cara también la atención por teléfono un poco sosa y sin detalle como la pizza me pareció hecha sin cuidado no creo volver a pedir a este sitio,2
28,"Café, Fusión, Saludable, Bar de vinos, Sudamericana, Costarricense",negative,probé el menú buffet del almuerzo el cual no fue nada especial ni en cuanto a sabores presentación variedad y calidad no repetiría siendo que hay gran variedad de restaurantes a su alrededor,2
29,"Café, Fusión, Saludable, Bar de vinos, Sudamericana, Costarricense",negative,fuimos por el buffet ejecutivo y en el momento de empezar a servirnos el encargado del buffet nos indicó no muy cortésmente que debíamos servirnos todo de una vez se refería a sopa ensalada y plato fuerte le indicamos que si nos servíamos de una vez se nos iba a enfriar el plato fuerte a lo que nos respondió que era que cerraban el buffet en 15 min no había rotulo que indicara el horario no le hicimos caso y le comentamos a la camarera y nos indicó que eso no era política del negocio a la semana siguiente volvimos y nos volvió a decir lo mismo por lo que decidimos no volver a este lugar,2
30,"Japonesa, Sushi, Asiática, Tailandesa",negative,nos toman la orden y 45minutos después nos indican qué si queremos sushi tenemos que esperar 40 minutos más y solo estábamos 3 mesas resulta que no había cocinero la que chef es la dueña y llegó tarde como puede funcionar un restaurante asi,1
31,"Japonesa, Sushi, Asiática, Tailandesa",positive,me gustó mucho la comida la mesera superior informada acerca de todos los platos y un lugar muy acogedor,5
32,"Costarricense, Caribeña, Internacional",negative,decepción totalfui con mi familia que venía de lima perú y quería pasar una tarde agradable con buena comida y estuvo fatal1 el salonero no conocía los platos y no pudo darnos más referencias que el menú lo leía literal2 el tartar sin sabor ni gusto 3 los tres panecillos del menú tienen demasiada harina nada de comida fina4 el capuchino terrible en costa rica puede haber mal café pue sí qué pena5 cambiaron el menú y ya no es cafetería solo restaurante así que olvídense para tomar un café con buenos acompañamientos como lo harían anteriormente6 para colmo el baño de damas no tenía papel higiénicoo sea una tarde fatal y una gran decepción antes era delicioso pero ahora decayó bastante es un lástima pues la chef sofía con mucha ilusión y esfuerzo abrió esta iniciativa,2
33,"Española, Mediterránea, Europea, Bar de vinos",negative,la calidad totalmente deficiente precios altos para el sabor y la cantidad pedimos una torta española insípida y seca unos chipirones crudos y sin sabor y un arroz caldoso con pollo sin arroz lo único bueno el vino de la casa un tempranillo de buen sabor mucho que mejorar terrible experiencia 40000 por dos carísimo,1
34,"Italiana, Pizzería",negative,fuimos con unos amigos tardaron mucho en servirnos no nos llevaron una ensalada y pretendían cobrarla y cobran las pequeñas muestras de queso y pestono lo recomiendo en lo más mínimo,1
35,"Francesa, Internacional",negative,tengo como 3 meses de ser cliente frecuente por lo menos 3 veces a la semana almorzando platillo de la carta religiosamente siempre el pollo a la pimienta hoy la textura del pollo era fea hulosa hice el reclamo y me lo cambiaron pero el que llevaron era la misma textura e inmediatamente lo devolví al pedir la cuenta noté que me lo cobraron por instrucciones de la jefa no sé si será la dueña los muchachos de servicio quienes me conocen y siempre atienden amablemente no sabían donde meterse por la pena pero cumplieron órdenes última vez que pongo un pie en este lugar creo deberían tener más aprecio hacia los clientes y más aún cuando somos frecuentes no era la primera vez que pedía ese platillo tampoco los visitaba de manera esporádica pero bueno para la jefa valía más cobrar el platillo que valorar un cliente frecuente,1
36,"Francesa, Internacional",negative,fuimos con mucha ilusión debido a las buenas críticas pero nuestra experiencia fue traumática sobre todo por la pésima atención de la mesera y del mesero quienes nos atendieron con mala cara con desprecio incluso y se portaban como si estuvieran en la cocina de su casa con su familia y la comida bueno nada como un casado de una soda del mercado que seguro son mejores salimos corriendo con la duda de si habríamos recibido esa descortesía absoluta por ser dos mujeres de francés solo el nombre por si acaso,1
37,"Churrasquería, Parrillada, Argentina, Española, Sudamericana",negative,el personal es amable pero lentopuede ser problema de cocina los calidad de la carne es promedio y los precios altos definitivamente no lo recomiendo hay otros lugares mucho mejores,2
38,"Churrasquería, Parrillada, Argentina, Española, Sudamericana",negative,carne quemada dura nada de buena calidad a un precio muy alto se olvidaron de la mitad del pedido no lo recomiendo para nada no es carne nivel argentino solo nombre,2
39,"Café, Asiática, Vietnamita, Saludable, Fusión",positive,solo me tomé un café pero nos atendieron muy bien el café estaba muy rico y fue una experiencia linda recomendado para una cita romántica o una plática más larga,4
40,"Café, Asiática, Vietnamita, Saludable, Fusión",negative,ensalada base de mucha lechuga no fresca cortada muy gruesa no muy fácil de usar chop stick o tenedor con vegetales no muy frescos y los agregados de carne o vegetales con la base seleccione el pescado el cual estaba muy ácido por dentro lo cual o estaba malo o lo mejor lo preparan con anticipación y absorbió la salsa ácida muy rápido me pareció no fresco no recién hecho pero como dicen que es estilo vienamiz como precalentado con una salsa de coco que del todo no sentí el sabor a coco y la porción del pescado fue pequeño y agregué los vegetales lo único bueno son los hongos mi esposo ordenó el boom el cual estába con mucha lechuga el de él estuvo un poco mejor pero a la hora de pagar nos pareció ms caro de lo que está en la carta buen ambiente y muy buena atención pero la calidad y el precio muy altos por el plato servido,1
41,"Latina, Internacional, Contemporánea, Centroamericana, Costarricense",positive,un lugar muy cómodo al tratarse de un restaurante ubicado en una casa antigua en barrio amón buena decoración la alimentación es agradable en cuanto a multiplicidad de sabores y colores aunque las porciones son relativamente pequeñas los precios son acorde a la calidad del servicio y alimentación tiene el servicio de valet parking con un costo de 3 mil colones el menú ejecutivo tiene un precio de 9 mil colones que incluye entrada bebida plato fuerte y postre en una zona rodeada de hoteles y restaurantes,4
42,"Latina, Internacional, Contemporánea, Centroamericana, Costarricense",positive,he ido ya 3 veces en la misma semana y espero ir todo lo que pueda en mi estancia en costa rica es de estella michelin,5
43,"Latina, Internacional, Contemporánea, Centroamericana, Costarricense",positive,en primer lugar el servicio es de excelencia el chef sumamente cuidadoso y detallista en la elaboración de los alimentos no existen los “no” en este restaurante todas las necesidades que tuvimos para la elaboracion de los platillos fueron tomadas en cuenta incluso variar el platillo por necesidad de una de las personas debido a alergia a alimentos,5
44,"Latina, Internacional, Contemporánea, Centroamericana, Costarricense",negative,me pareció sumamente caro y la comida no estaba a la altura de los precios el lugar es más apariencia que otra cosa,2
45,"Latina, Internacional, Contemporánea, Centroamericana, Costarricense",positive,es un lugar muy agradable bien decorado en una casa antigua de san jose la comida fusion tica e internacional me gusto mucho muy bien servido,5
46,"Latina, Internacional, Contemporánea, Centroamericana, Costarricense",positive,el día de ayer mi novia y yo fuimos a su restaurante para celebrar nuestro sexto aniversario escogimos dos menús degustación y el maridaje de vinos la comida fue excelente tanto en presentación como en sabor gran innovación de la comida tradicional costarricense,5
47,"Internacional, Mediterránea, Europea",positive,sin lugar a dudas jurgens es para mí de los mejores restaurantes de costa rica el menú súper variado cada mes preparan un menú especial y en ocasiones prepara platillos especiales increíbles para festivales de hamburguesas que sin lugar a dudas destacan de cualquier otro excelente ambiente y atención,5
48,"Internacional, Mediterránea, Europea",positive,no puedo decir suficientes cosas buenas acerca de este restaurante la comida se sirve fresco así que está siempre a la temperatura deseada he comido allí varias veces durante mi estancia en costa rica y tiene benin maravilloso cada vez además de la buena comida los camareros hacen lo imposible para asegurar su satisfacción sin duda uno de los mejores restaurantes que he comido,5
49,"Internacional, Mediterránea, Europea",positive,un pequeño hotel boutique hotel restaurante contiguo excelente servicio y la comida es genial en un pujante barrio lo recomiendo para el almuerzo o la cena,4
50,"Internacional, Mediterránea, Europea",negative,no es el mejor lugar para comer sin duda la comida es internacional pero no es tan bueno como se piensa al entrar en el restaurante el lugar es agradable pero la comida no está a la altura de la expectativa inicial,1
51,"Latina, Bar, Centroamericana, Costarricense, Fusión",negative,el casado muy malo y caro para nada el arroz insípido los frijoles dulzones feo un maduro con miel lleno de clavos de olor por lo que en cada cucharada venía ese sabor fuerte de los clavos por lo que lo hizo una pésima experiencia y la carne en salsa eran como 3 pedacitos de carne lo demás eran pellejos y cargado de chile dulce y cebolla le faltaba sabor y el servicio demasiado lento y duradero,2
52,"Latina, Bar, Centroamericana, Costarricense, Fusión",positive,de visita en costa rica pura vida hoy en el city tour nos llevaron para almorzar rica comida excelente servicio de anthony gracias por la recomendación del mojito de cas 😋,5
53,"Latina, Bar, Centroamericana, Costarricense, Fusión",positive,comida muy buena típica tica el camarero anthony muy agradable servicio espléndido para una primera visita en san jose muy recomendable,5
54,"Latina, Bar, Centroamericana, Costarricense, Fusión",positive,muy buen local para probar buena comida costarricense pedimos un plato para dos personas donde vienen varias diferentes tipos de comidas típicas y estubo delicioso además la atención de nuestro mozo anthony estubo espectacular muy atento y simpático hasta nos regalaron una foto con nuestro plataso el local es bien bonito y limpio recomiendo este restaurante a cualquiera que sea nuevo en costa rica o no y quiera comer algo super rico típico y quiera una muy buena atención 1010,5
55,"Latina, Bar, Centroamericana, Costarricense, Fusión",positive,menú amplio comida típica y diferente agradable comida rica música en vivo buena infraestructura con adornos típicos,5
56,"Latina, Bar, Centroamericana, Costarricense, Fusión",negative,en realidad no lo considero comida costarricensecreo que le falta mucho además es caro lo que me gusta es el café chorreado en la mesa,2
57,"Latina, Bar, Centroamericana, Costarricense, Fusión",positive,es un sitio bastante típico y agradable con comida sabrosa y como nos pasó en todo costa rica una atención estupendaes quizás un poco para guiris turistas que caemos por allí por casualidad o recomendado pero con precios no demasiado por encima de la media que en general el caro,4
58,"Latina, Bar, Centroamericana, Costarricense, Fusión",negative,siempre lleno de gente por dedicada atenciòn sus abundantes y exquisitos platos y la rapidez conque los preparan la carta es extensa hay para todos los gustos,2
59,"Latina, Bar, Centroamericana, Costarricense, Fusión",positive,muy amables las personas dependientes escuche atender en ingles y español muy bien la comida tipica y tradicional de costa rica en un ambiente agradableen el centro de san jose muy accesibles super buena calidad y sabor,5
60,"Latina, Bar, Centroamericana, Costarricense, Fusión",positive,muy local el ambiente pedimos los platos tipicos que tienen lomito uno a la plancha y el otro con salsa de queso excelente sabor y super suaves los acompañamientoe el gallo pinto platano maduro ensalada y creo que se llama revoltilo muy buenos la atención es excelente y la coordialidad del personal,4
61,"Latina, Bar, Centroamericana, Costarricense, Fusión",negative,hoy visite el restaurante con una pareja de adultos mayores de uruguay por la cercanía al museo y por el tema de comida típica decidí esta opciónpésima elección los saloneros sumamente lentos y descortéses ninguno nos quería atender no sé porqué seguramente pensaron que todos eramos nacionales o que no íbamos a dejar propina porque curiosamente un grupo de usa que se sentó a nuestro lado fue atendido en forma inmediata la comida es regular aunque lo sentí demasiado caro para la calidad los refrescos naturales sin sabor muy desagradablebusquen otras opciones no vale la pena visitarlos,1
62,"Latina, Bar, Centroamericana, Costarricense, Fusión",negative,muy caro prefiero ir al mercado central tiene mejor comida y a un mejor precio este es el tipico restaurante que vende comida tipica a precio internacional,2
63,"Latina, Bar, Centroamericana, Costarricense, Fusión",negative,pesimo lugar no ponen atencion a tu solicitud te recomiendan un churrasco con la carne mas dura del mundo llena de pellejo y tratan de arreglarlo tomandote una foto no regresare,1
64,"Latina, Bar, Centroamericana, Costarricense, Fusión",negative,sin embargo en lo que respecta a la comida que es lo más importante no es de lo mejor la comida no es totalmente típica no es lo que encontrarías en el mercado o en una fuente de soda donde sí podrás conocer la verdadera comida típica del lugar por otra parte los platos eran exageradamente grandes y el precio era muy elevado en relación a la calidad de la comida,2
