,Tipo_Comida,Calificacion,Comentario,Calificacion_Comentario
233,"Mediterránea, Del Medio Oriente",negative,será que lo visite en el momento no adecuado puede ser lo visite durante el festival gastronómico 130 horas de espera y al resto de mesas si las atendían medianamente mejor que la nuestra entiendo que quizás no esperaron la cantidad de personas será pero a eso se dedican o no el festival de cordero lo trajeron para 2 personas y lo pedí para 1 los ravioles eran en salsa de tomate y llegaron en salsa blanca las bebidas llegaron con 25 de atraso cero servilletas la camarera se disculpa pero no hace nada por remediarlo creo que es un buen restaurante pero para nosotros la experiencia fue pésima escuchar comentarios de la cocina donde se le acabo x producto cierre la cocina o caras y malos tratos deja mucho que desear,2
234,"Mediterránea, Del Medio Oriente",negative,pero en un restaurante la comida es lo principal comida servicio y precios van de la mano en mi visita este lugar me quedó debiendo una entrada que el menú indica es para dos personas pasa de ser una primera impresión y te invita a no seguir porciones minúsculas con un pan nada fresco mal aliñado y comercial no podría creer que es preparado ahí mismo en nada emula a un pan artesenal del mediterraneo que a pesar de múltiples recetas no puede ni debe ser como el ofrecido en mi visitamuy mezquina la porción de las muestras las cuales han de haber estado refrigeradas por un buen rato tanto rato que de guardar la frescura de los ingredientes se pasa a ingredientes añejos refrigerados sin importar ser una entrada dista mucho de ser para dos comensales esto junto con una atención desinteresada y a la ligera del mesero quien se limitó a tirar las cartas sin ningúna recomendación sugerencia o explicación preferí terminar mi entrada que con dos bebidas ya sumaba 26 dólares americanos decidí abandonar el sitio dejando a otros comensales la expreriencia de los platos fuertes y postres ya que si por la víspera se saca el día y si hasta la caja tuve que ir a cancelar la factura y retirar el vuelto no me imagino que hubiese pasado de haber ordenado algo más,2
235,"Mediterránea, Del Medio Oriente",negative,ok lo primero que quiero dejar claro es que mi comentario no tiene la intención de decir ni se acerquen a ese lugar es malisimo etc etcsimplemente quiero compartir mi horrible experiencia con ustedes para que tomen ciertas previsiones y no les pase como a nosotrosreservamos una noche para el cumpleaños de mi esposa especial por se su número 30 eramos 20 personasllegamos primero 7 personas a las 730 pmle dijimos claramente a la mesera vamos a ir pidiendo comida no vamos a esperar a todos vamos pidiendo van trayendo van llegando y pidiendo van trayendo ok nos ofrecieron por ser martes de paella una paella para una persona y paella para 2 personas ojo con este detalleok a las 8 pm en punto se pidieron las 4 primeras ordenes una paella para 2 personas un pescado con papas a la francesa para una niña de 9 años una pasta con algo y otra paella para una persona mi esposa y yo pedimos una entrada y el plato de ella una corvina y mi plato unas chuletas de cordero a la parrilla con raviolis rellenos de ricotta y espinaca este lo especifico bien porque es importante bueno primero que nada eran las 945 pm y no habíamos recibido ninguno de los platos o sea 1 hora 45 minutos después y solo habíamos recibido la entradapor supuesto ya había ido llegando en ese lapso de tiempo más invitados que iban pidiendo y obvio tampoco habían recibido su comidacuando nos molestamos comenzaron a aparecer los platosel plato de mi esposa una corvina fría se ve que estaba lista para servir antes y no entendemos porque no la habían hechomi plato ok mi plato se recuerdan las deliciosas chuletas de corderos con ravioles bueno estaban las chuletas con 4 pedacitos que nunca supe que era zuquini o berenjenas totalmente quemadas con 2 pedacitos de tomates pero bueno entre quemados e impresentables le pregunto srta esto no venía acompañado de ravioles me dice uy sr es que hoy no hay ravioles lo servimos con vegetales entonces mi enfado fue porque no me dicen desde un principio que no hay ravioles y que lo sustituyen con que a ver si yo lo acepto y 2do cuales vegetales le llaman vegetales a 4 pedazos de berenjenas y 2 pedazos de tomates yo ni berenjena como le digo se lo puedo cambiar por arroz o papas fritas o sea el mega plato de 12 mi colones que lo tengo que pagar me lo tengo que comer con papas fritas excelente no gracias solo me voy a comer las chuletasla pena del siglo fue cuando una amiga ordeno una paella para una persona y otra pareja ordeno una paella para 2 bueno le trajeron una paella junta que dijeron que era para 3 y le sacaron de esa paella un minúsculo plato con la porción a la persona que esperaba una paella individual que les parece otro compañero ordeno una paella para una persona mixta mariscos y pollo le llego su paella pero él se da cuenta que no tiene pollo y le pregunta mire srta y el pollo ayyyy no le pusieron o sea por supuesto la tuvo que pagar como mixta creo porque ya la verdad con tanta pena que tenía por nuestras amistades y familiares ni preguntebueno invitados que había llegado mucho después ya estaba comiendo otros molestos por todos los problemas de tiempo y adicional ordenes incorrectas se acuerdan el que ordenó a las 8 en punto una pasta aún no se la servían casi 1030 de la noche creemos que la mesera no tomo la orden o de verdad vuelvo y repito ya simplemente no nos importaba saber cual fue la razón lo único que queríamos era pagar y salir corriendorecomendaciones para el restaurante1 no acepten reservaciones grandes a simple vista se notó que no tienen la experiencia para manejar ese volumen de personas en una misma mesa2 si ofrecen platos para una persona y para 2 personas no se invente platos en plena velada de 3 personas es de mal gusto y muy desagradable esa persona no comió absolutamente nada y tuvo que pagarlo como un plato individual3 tienen un menú cierto si el menú dice que viene acompañado con tal guarnición y no la tienen informen al cliente para que este decida si quiere el plato o no no se lo traigan y le dicen cuando no tenemos esto le ponemos aquello es como ir a un restaurante francés y pedir un plato muy costoso de pato y cuando te llegue la orden veas unos nuggets y te digan es que cuando no hay pato lo cambiamos por nuggets y lo peor tenemos que pagar un plato caro de pato4 no es justo esperar hora y 45 minutos para cenar y otros hasta 2 horas pasadas por un plato de pasta5 tengan la decencia de algo reintegrar algo de lo que se ordeno y no fue recibido porque pague por un plato de 12 mil colones de ravioles y lo cambian por berenjenas y tomate e impresentables yo esperaba que me dijeran disculpe su plato va a costar tanto porque cambiamos ingredientes muy costosos de ese plato como ravioles ricota y espinaca y de dificil preparación por unos pedazos de berenjenas y tomates quemadosconclusiones de la noche tristeza de preguntarle a mi esposa dentro del carro bueno al menos nos reímos con los invitados como la pasaste y de escucharla casi apenada fue una congoja ver a todas mis amistades bravas por el servicio y no a gusto la pase muy mal en mi cumpleañosno puedo ni siquiera decir que si estaba buena o no la comida porque con tantas desagradables situaciones era imposible intentar saborear algosi hubiese estado con mi esposa o tal vez una pareja más no acepto esos platosde nuestra parte vetado de por vida este restaurante,1
236,"Mediterránea, Del Medio Oriente",positive,la comida es fresca y la atención es excelenteesta bien ubicado cerca de lugares de interes turísticola frescura de sus platos y la asesoria a la hora de elegir los platos es un factor importante para volver y recomendarlo a muchas personas,5
237,"Mediterránea, Del Medio Oriente",positive,comencé a este restaurante hace unos años cuando se llamaba aya sofia un colega y yo solía comer allí cuando trabajamos juntos me encanta el cordero platos las bolas de carne los platos sampler el café turco y el baklava con los años llegué a conocer mehmet el propietario fui a dos de las noches de arte y cultura uno en la comida del imperio otomano y la otra en la cocina siria conversaciones fascinantes tobogán presentaciones y la comida es fabulosa mehmet y algunos amigos mutuos vinieron a mi casa hace unos años y preparado una fiesta una delicia no vivimos en costa rica pero ya he visitado la semana pasada y lo principal en mi horario era para ir a almorzar en sofia mediterraneo,5
238,"Mediterránea, Del Medio Oriente",positive,excelente comida en un ambiente otomano gran noche vimos una presentación sobre el sultán y tradiciones en el imperio otomano pudimos conocer nuevas especias,5
239,"Mediterránea, Del Medio Oriente",positive,a pie de sofía mediterraneo es como entrar en una experiencia en algún lugar en el mediterráneo los olores de especias antiguos preciosos como cardamomo y comino hace que uno quiere probar cada plato en la junta de especial las carnes son mi favorito pero tuve la suerte de cenar con un grupo de nosotros y estuvimos encantados de haber una mezcla de platos vegetarianos además de pescado el plato de atún es para morirse y el chuletas de cordero no te quieres compartir con nadieme quedé satisfecha cuando eran tan complacientes con el pedido de mi 1 y 12 año para bebé más pan y delicioso baba ganoush el personal es amable y eficiente de sus platos y vinos el propietario y el director son una delicia para hablar y sobre todo un lugar estupendo en barrio escalante para pasar el tiempo descubriendo las maravillas de la cocina mundial sin duda se lo recomendaría a cualquiera que le guste un buen ambiente con una comida buenísima,5
240,"Italiana, Mediterránea, Europea",positive,la comida y el servicio te hacen sentir en italia un lugar acogedor excelentes vinos y la comida exquisita,5
241,"Italiana, Mediterránea, Europea",negative,fuimos un grupo de amigos a cenar a la entrada no había un anfitrión que nos atendiera tuvimos que hacerle señas para que se diera cuenta luego de 15 minutos nos arreglaron la mesa y como le dijimos al mesero que aún faltaban otros amigos por llegar simplemente se fue y no volvió a acercarse a la mesa como nuestros amigos faltantes se retrasaron decidimos pedir la orden y aún con señas y llamados el mesero no se acercaba sino al rato pedimos entre otras cosas sopa de tomate natural y sorpresa que cuando nos las sirvieron era sopa de caja no era natural al reclamar al mesero éste titubeó se fue a preguntarle al chef y nos cuenta que el chef manifestó que era sopa natural pero que a él no le consta sino que es mandado el chef nunca apareció en nuestra mesa también pedimos lomito al amaretto la carne muy buena y jugosa no así la salsa de amaretto que estaba bastante dulce la pizza nada del otro mundo en general el servicio del mesero muy deficiente y la comida ha bajado de calidad ante nuestras observaciones el dueño trató´de enmendar lo sucedido con digestivos de cortesía un restaurante como este situado en un barrio con tanta oferta gastronómica debería cuidar estos factores ante estas alternativas dejaremos de ir a este restaurante por mucho tiempo,2
242,"Italiana, Mediterránea, Europea",positive,increíble la corvina de tony al horno lomo de corvina especial de primera con vino blanco mantequilla y especias acompañada con pasta al dente o vegetales tiernos y frescos verdaderamente una delicia para recordarpor otra parte el servicio excelente expedito respetuoso en un ambiente cálido y agradable,5
243,"Italiana, Mediterránea, Europea",positive,excelente cocina ambiente muy agradable y buen chef muy concurrido al mediodíamuy bueno el risotto a la pescatora,4
244,"Italiana, Mediterránea, Europea",positive,el primer restaurante que he conocido desde cuando vivo en costa rica de verdadera comida italiana y mediterránea seguramente es el mejor entre todos lo recomiendo,5
245,"Italiana, Mediterránea, Europea",positive,localizado en una hermosa zona el local es agradable no tiene parqueo pero los carros de pueden dejar al frente al lado de la calle sin mayor inconvenientefina atención comida italiana con variedad de pastas pizzas y carnesel precio es el justo y el tamaño de las porciones el adecuadosus dueños ciro y tony contribuyen con la atención del lugar,4
246,"Italiana, Mediterránea, Europea",positive,con el paso de los años tony a pesar de haber cambiado varias veces de local sigue siendo el mismo gran chef que hemos tenido el placer de conocer por sus platos y su trabajo profesional ahora junto a ciro nos sorprendieron con este nuevo local muy espacioso y con una presentación impecable de sus platos ideal para disfrutar un buen almuerzo o cena en un lugar con muy buena atención y como siempre disfrutando de la gran variedad de platos y recomendaciones de los chef,4
247,"Contemporánea, Bar de vinos",negative,había escuchado muchísimo de este lugar pero lamentablemente todo estuvo mal dos botellas de vino devueltas y una comida sumamente grasienta en lo positivo tiene un bonito ambiente,1
248,"Contemporánea, Bar de vinos",negative,veníamos muy recomendados por amigos muy emocionados por probar este nuevo lugar el menú es diario y entendíamos que cambia día a día pero el día que vinimos no fue el día empezamos con tragos terriblemente preparados aperol spritz casi sin aperol y un tinto de verano vino y jugo de naranja la comida parecía peor que hecha en casa una pasta con tomate y broccoli adobada con lo que parecía cubito maggie el risotto de cordero sumamente amargo con sabor sumamente desagradable a arroz con leche hecho con leche evaporada una experiencia que deja mucho que desear en resumen no vale la pena calidad inferior por un precio muy alto,1
249,Internacional,negative,los platillos perdieron su toque de antes no sé qué pasó el lugar es muy agradable por eso me gustaba visitarlo tal vez mala suerte debe mejorar la calidad del platillo,2
250,Internacional,negative,prácticamente me echaron del lugar a pesar de que estaba vacío varias meseras se quedaron frente a la mesa haciendo presión para que no fuéramos y además comentaron pero si ellos ya se van recogieron la mesa en muchas ocasiones lo cual resultó muy incómodo dejo claro no tenía ni una hora de haber llegado al lugar lo cual el tiempo no era inconveniente y aún no era la hora de salida en mi vida volvería a ese lugar y cuánta gente puedo les comento de la mala experiencia vivida en este lugar,1
251,Internacional,positive,ratillo tengo ya de no ir pero de mi memoria no olvido los hongos rellenos con una copa de vino en medio de velas y una buena compañía pero sobre todo el postre de pecanas mmmm que rico de aspecto urbano pero cálido ambiente súper recomendado y grandes recuerdos tengo de almuerzos y cenas con amigos y pareja buen parque y precios razonables,4
252,Internacional,positive,un gran lugar de gran variedad en su carta de menúsus pequeños detalles lo hacen grande y su atencion especialmuy recomendado para una noche con amigos o pareja para pasar un momento bonito y compartir,5
253,Internacional,negative,después de semanas cenando en restaurantes de comida costarricense decidimos ir a un restaurante internacional como venía en la guía lonely planet pedimos una pizza para cenar y tal fue nuestra decepción parecía una pizza que compras en el supermercado y además lo peor de todo es que llevaba una pasta de frijoles en lugar de tomate como base nuestras ganas de comer algo diferente se esfumaron y además el sabor de la pizza dejaba mucho que desear puede que los demás platos estén mejor pero la pizza no es su fuerte,2
254,Internacional,positive,café mundo es interesante desde el momento en que se entra está muy bien decorado y cuenta con grandes salones que te da la opción de ir a almorzar con grupos de amigosyo lo visito a menudo para el almuerzo y las opciones de plato del día siempre son muy buenastradición en este restaurante es cuando te traen el pan que consiste en tres tipos de panes debes de mojarlos en aceite de oliva aromatizados y comerlo antes de que llegue la comidalos frescos naturales son muy buenos y al final siempre te dan una pequeña muestra de postre como cortesíaen las noches tiene también su ambiente y es ideal para tomarse un vinito,4
255,Internacional,positive,en café mundo siempre todo esta genial un restaurante con buen ambiente siempre te encuentras amigos la comida simplemente deliciosa y lo mejor su personal con ese carisma característico mas que recomendado,5
256,Internacional,positive,siempre que puedo voy a cenar o almohada a café mundo uno de mis restaurantes favoritos por sabor atención precio platillos y demás,5
257,Internacional,positive,café mundo tiene una atmósfera mistica que lo hace una experiencia única cada vez que se visita definitivamente nunca me defrauda probamos uno de los especiales del día que era un dip de pejiballe y realmente es de lo mas rico que he probado el servicio realmente bueno a pesar de estar con una capacidad bastante alta la comida en general con un nivel extraordinario y para cerrar el famoso bavarois de tres chocolates que cada vez que lo pruebo me recuerda que definitivamente es mi postre favorito felicidades,5
258,Internacional,negative,no fuimos solo la mesa pero varios los grupos de amigos que el mes de marzo sufrimos los síntomas de la bacteria estafilocócica gracias a lo que comimos en café mundo razones de sobra para hacer la denuncia pública también por este medio ya que la denuncia ante el ministerio de salud no asegura ningún cambio inmediato,1
259,Internacional,positive,zona muy mediocre para comenzar pero una vez allí la comida era bastante buena y si quieres puedes ir en el menú el personal puede haber tenido una mala noche ya que el servicio era bastante pobre nuestro amigo dejó un vaso de vino y ella era usar sandalias y el personal ni siquiera limpiar el cristal hasta que nos fuimos apenas dar este lugar 3 estrellasno volver,3
260,Internacional,negative,esto no ha sido el caso en los últimos años ya que los dueños son claramente mucho más interesado en una noche multitud de bar se han ampliado y renovado espacio adicional para esto si lo que quieres es una comida ve a otro lado,2
261,Internacional,positive,este es un buen lugar para pasar el rato con amigos o familia la comida es genial el servicio excelente en tiempo y en una buena manera el lugar es muy agradable con un ambiente internacional,5
262,Internacional,negative,pero la comida aquí fue probablemente los más débiles que tuvimos durante nuestra semana de costa rica vine aquí tarde un domingo por la noche y el lugar estaba bastante lleno sopa ensalada pasta con la ensalada siendo el más inspirados de éstas la camarera no era demasiado respnsive o cuando le preguntamos sobre las ofertas especiales o el tamaño de las comidas,2
263,"Bar, Centroamericana, Pub, Costarricense",negative,el problema fue la bebida pidieron cerveza les ofrecieron cerveza artesanal usualmente se sirve en vaso o jarro pero no en una copa de vino la cantidad de cerveza en una copa era poca y encima cara no creo que vuelva hay otros lugares muy lindos y más economicos se paga la zona cuando se va a apotecario,2
264,"Italiana, Mariscos, Mediterránea, Europea",positive,excelente servicio y la comida deliciosa definitivamente recomiendo el restaurante estuvieron muy atentos para cualquier cosa que necesitáramos,5
265,"Italiana, Mariscos, Mediterránea, Europea",positive,hace rato no íbamos a este restaurante y decidimos darle otra oportunidad que agradable sorpresa pedimos el rissotto con hongos y el rissotto con camarones y ambos estaban exquisitos como siempre los meseros súper atentos y hasta el chef salió a preguntar si todo estaba bien además de postre pedimos los profiteroles y la panna cota y estaban deliciosos definitivamente quiero volver sobre todo a probar la lasaña de la nonna recomendado,5
266,De la India,positive,excelente variedad de platos probamos cordero y pollo y ambos están muy bien los precios incluido un refresco natural andan alrededor de 15000 por persona,5
267,De la India,positive,es un delicioso restaurante además de ser cómodo sus platos están llenos de olores y sabores que para los amantes de las especias será una delicia absolutael servicio es muy bueno todo es bueno la verdad y para aquellos que tanto os gusta este restaurante no entiendo porque le dan 4 estrellas en lugar de cincosi lo merece lo merece,5
268,De la India,negative,increíble que pida “solo agua” para acompañar la comida y que decidan cobrar 3000 colones somos ticos es la norma que tomamos del agua potable de nuestro país si al menos hubiera preguntado el mesero si preferíamos del tubo o en una botella de vidrio que tenía costo pues menos mal pero simplemente apareció en la factura además el sabor no era el mejor que haya probado en comida india mala relación preciocalidad no lo recomiendo hay mejores por la zona,2
269,De la India,positive,siempre que vamos a comer comida hindú vamos a 506 y nunca hemos tenido quejas mantienen siempre el excelente estándar de cálidad todo lo que hemos comido siempre nos ha gustado y los meseros son super amables,5
270,De la India,positive,el servicio es muy bueno el lugar muy acogedor y el ambiente muy bueno al ser pequeno y cerrado el olor del curry es muy fuerte por lo que algunas personas les puede parecer bastente incomodo con respecto a la comida pedimos un pollo tikka massala un plato surtido con cordero pollo y res y un naan de queso el plato surtido venia con un curry pero al final resulto ser el mismo que traia la salsa tikka massala lo cual no deberia ser asi puesto que son preparaciones distintas al final ambos platos tenia un fuerte sabor a curry que no permitia ningun otra especie sobresalir el pan si estaba muy bueno y el arroz pero los platos principales bastante regular precios alrededor de 8000 a 13000 colones 1525 por plato,3
271,De la India,positive,es el mejor restaurante de comida i dia del país un local que conserva el auténtico sabor de su gastronomía,5
272,De la India,positive,la comida es deliciosa y el servicio es muy bueno buena relación calidadprecio para los amantes de la comida india ¡recomendadísimo,5
273,De la India,positive,la comida y servicio fueron excelentes y la comida es legitima de la india también son muy atentos a las necesidades de los vegetarianos y los veganos,5
274,De la India,negative,en resumen yogurt vencido en un lassi el dueño diciendo que el cliente no tiene la razón una bebida cobrada doble y al reclamar intentaron echarnos del local la comida no es mala pero solo la actitud de los que sirven me causaron indigestión luego nos trataron de mentirososno volveré nunca,1
275,De la India,positive,esta es sólo la tercera vez que me han dado cinco estrellas a un restaurante me llevé a mis clientes de costa rica aquí para cenar y mi cliente siendo india me dijeron que este lugar era excelenteel restaurante se encuentra en el extremo de un pequeño centro comercial y cuando vas dentro de los aromas de la india son una maravilla el lugar está bien iluminado y decorado con un ambiente muy cálido y acogedor nuestra camarera la mujer del dueño era amable y llevó a cabo una sonrisa permanente el servicio era excelente el vino fue buena pero la comida era verdaderamente excepcional aunque me encanta en los estados unidos soy originaria de inglaterra así que me encanta la cocina india comimos un montón por favor prueba el seekh kebab cordero a la parrilla y delicada baja formada en un pincho la mejor que he comido nunca también prueba el picante naan el chef operado un restaurante indio en escocia y creado para la gente deliciososuna experiencia maravillosa y volveré gracias chef kamal,5
276,De la India,positive,nos alojamos una noche en sj en nuestro camino de regreso a la península de osa por desgracia el hotel que habíamos reservado no estaba para nada cerca del aeropuerto sin embargo si hubiéramos estado más cerca que nunca habría podido comer en sabor de la india el restaurante está bien decorado y cuenta con cómodos asientos pedimos pakora vegetal que estaba perfectamente preparado no en grasa pollo tikka papadam con chutney de mango y otro plato de pollo no recuerdo el nombre que fue preparado con jengibre capsicum y cilantro terminamos la comida con arroz con leche todo lo que comimos estaba delicioso si volvemos a sj sin duda comer aquí de nuevo ¡muy bien,5
277,De la India,positive,este es el increíble lugar para quien quiere probar comida india gran gusto y un gran ambiente y muy amable propietario kamal grandes saludos a mantequilla delicioso pollo y picante nan debe probar lugar para cualquier entusiastatodo lo mejor,5
278,De la India,positive,pequeño lugar con gran ambiente y servicio auténtico sabor indio y increíble relación calidadprecio,5
279,"De la India, Asiática, Saludable, Parrillada, Sopas",positive,increible experiencia la decoracion el ambiente atencion y musica excelentesla comida sumamente deliciosael precio de acorde al sitio y a la calidad no son excesivos,5
