,Tipo_Comida,Calificacion,Comentario,Calificacion_Comentario
450,"Café, Sudamericana",positive,el dueño te espera a usted mismo él es tan atento y pasa tiempo explicando y te ayuda a decidir qué es mejor f o a la orden su desayuno de burrito era caliente sabroso y la calle cappuchino perfecto está muy limpio y bien ventilado por dentro él también nos ayudó con las direcciones y ideas para excursiones ya que estamos visitando a su país por primera vezél ha estado abierto por sólo 5 meses pero tiene una buena ubicación buenos productos y una actitud fantástica ve a ver él,5
451,"Italiana, Mediterránea, Pizzería",positive,ubicado en el segundo piso de escazú village tiene un menú variado sin ser nada fuera de lo común los platos muy buenos servicio bueno precios medioalto,3
452,Café,positive,que éxito una combinación exquisita de sabores un nivel de calidad francés con un toque y sabores costarricenses,5
453,"Bar, Estadounidense",positive,el lugar es muy agradable buena música y partidos varias tv tiene muchas opciones en el menú y el personal está dispuesto hacer las variaciones a los platos para complacer a los clientes,5
454,"Bar, Estadounidense",negative,decidí ir a henrys con mi primo que estaba de visita desde estados unidos ya que estábamos viendo el partido decidimos tomar algunas cervezas como de costumbre el camarero nos preguntó a ver nuestro id pero no acepta el id de mi primo por ser un extranjero aunque ella es de 19 años me dije que si ella era un extranjero que tenía que llevar su pasaporte actual lo que me parece completamente absurda ya que es muy fácil perder un pasaporte si vas a tratar a sus clientes extranjeros en tales sentidos entonces te vas a asustar más probable es que lejos de los turistas así que en vez de pedir cervezas acabamos de agua después de que pedimos tres aperitivos que duró 30 minutos para estar listo y tres vasos de agua simple que duró 45 minutos para llegar a la mesa por el precio creo que el servicio era terrible y los turistas no son tratados correctamente no cabe duda de que no volveríamos,2
455,"Mariscos, Peruana, Latina",negative,el día de hoy visité el restaurante y quería degustar el platillo del salmón sin embargo a pesar que tiene un sabor aceptable no fue de mi agrado creo que deberían reinventar este platillo,2
456,"Mariscos, Peruana, Latina",negative,la leche de tigre ni la intenten pedir es un intento fallido de la original el servicio es bastante malo nada comparado al de alajuela el de allá si lo recomiendo,2
457,"Peruana, Latina, Mariscos, Española, Fusión, Sudamericana",negative,acabamos de estar en el restaurante y no queda mas que decir que ni pudimos comer llamamos antes de ir para ver a que hora cerraban cocina y nos contesto una niña llamada ana y nos dijo que cerraban cocina a las 11 teniendo en cuenta eso llegamos al restaurante a las 10 nos recibe el salonero y empieza a preguntarnos que que vamos a pedir sin darnos tiempo de leer la carta le pedimos que nos de tiempo de ver la carta y se va y vuelve al poco tiempo le volvemos a pedir tiempo y se va y vuelve de nuevo y nos dice que no es por molestar pero que la cocina cierra a las 1030 siendo las 1005 no sabemos cual era el afan o bueno si sabemos ya querian cerrar le digo que yo llame y me dijeron que cerraban cocina a las 11 y me dice que el dueño del restaurante esta en la cocina con el chef y que ya van a cerrar nunca nos habia pasado esto es un restaurante fue tan indignante que preferimos pararnos e irnos a comer a otra parte,1
458,"Italiana, Pizzería",positive,muy acogedor y excelente servicio la comida no tiene comparacion es un lugar para toda la familia por tal razon es recommendado,5
459,"Internacional, Española, Bar de vinos, Mediterránea",positive,fui allí con mis amigos y lo pasamos genial el servicio es maravilloso tienen un bar de vinos especiales para después del horario de oficina hora feliz probé diferentes tipos de vino ya que ofrecen varias opciones de 2 onzas de vino también tienen un mercado de vino en caso de que quiera comprar cualquier de los vinos que probamos y mucho másla comida era buena los tamaños eran entre un tamaño de tapa y un campo así que necesitas probar algunos para comer una comida completa pero los precios son razonables la presentación de la comida también es maravillosa la última noche sábado incluso tenían música en vivorecomiendo encarecidamente este restaurante,5
460,Italiana,negative,nuestro camarón ennegrecida era casi cruda y el servicio era terrible,2
461,"Latina, Española",negative,ni siquiera llegar a probarlo peor actitud posible del personal apuesta la comida es buena pero muy negativo ambiente,1
462,"Churrasquería, Sudamericana, Costarricense",negative,el pollo caribeño de eso no tiene nada de sabor es muy simple y seco para nada lo recomiendo el disque riceandbeans también no tiene nada de sabor,2
463,"Churrasquería, Sudamericana, Costarricense",negative,una decepción al pedir una picańa de muy mala calidad me sentí estafado en la porción y lo dura de la carne digna del mejor zapatero,1
464,"Café, Internacional",negative,lastima que el servicio estuvo fatal aparte sólo 1 silla de bebe tienen y no tienen cambiador para bebés,1
465,"Bar, Estadounidense, Pub",negative,fui el viernes 15 dic fuimos comer a este lugar dos personas pedimos 20 alitas 1 orden de papas y una jarra de cerveza y pagamos casi 39 mil colones esto me parece ridículamente caro al menos no perdí la lección ya tengo muy claro dónde no ir nunca que robo,1
466,"Bar, Estadounidense, Pub",positive,grandes platos me gustó el servicio bocas amable y bastante rápido pedir la cerveza sin hielo si no quieres cualquiera,4
467,"Bar, Estadounidense, Pub",negative,paramos en un viernes por la noche por una cerveza y nachos nachos eran caros y nunca me preguntó si quería más de 1 cerveza sábado en el bar durante 20 minutos con un vaso vacío de cerveza y estaba completamente ignorado y ni siquiera se llena de gente,2
468,"Café, Sudamericana, Costarricense",positive,un cafe cuyos propietarios son de barcelona españa han venido desde la lejania a preparar cafe y deliciosos jugos naturales en medio del pintoresco pueblo de escazu un lugar un tanto bohemio donde se rescata el gusto por los elixires de la dieta saludable con una decoracion simple y ecologica vale la pena darse una vuelta y recibir la voz catalana de bienvenida benvingut,4
469,"Parrillada, Parrilla, Mediterránea",negative,visitamos este restaurante recién abierto y llegamos a la conclusión de que más que su oferta gastronómica con lomque contaba era con una excelente campaña publicitaria el lugar carece de ambiente propio lo que hace que la música del restaurante argentino contigo a maradentro invada todo el ambiente tiene un menú muy limitado que creo que lo condena a su poco público en toda la noche se ocuparon tres meses,2
470,"Sudamericana, Costarricense",negative,sin embargo si quisiera hacer la observación de que la música estaba extremadamente alta para un restaurante familiar sin mencionar que era reguetón y luego mi hija me pregunto porque el cantante decía que felices los 4 de pésimo gusto para cerrar tienen banners del bac de 150 mts por todo lado anunciando un descuento de 30 si pagas con una tarjeta del banco pues a la hora de pagar el chavalo de la caja no dice nada y cobra la cuenta completa no necesitaba el descuento ni le mencioné nada a el colaborador y me retiré con esa sensación tan espantosa de no haber podido disfrutar de un almuerzo agusto en un feriado asesórense con el staff de heredia ellos si saben atender al público segunda y última vez,2
471,"Mexicana, Latina",negative,de los 3 comensales las frases fueron1lo mejor fieros los frijoles del burro y el chile2la sopa azteca como si el mismo tenosticlan la hubiera hecho3 hamburguesa me he comido mejores a 1600 colones,1
472,"Mexicana, Latina",negative,las alitas son secas y parecen de canario devolví el plato y querían cobrarlo después la calidad de la comida ha bajado mucho,1
473,"Peruana, Sudamericana",negative,hace un año lo visité y el sazón de la comida peruana fue éxito ahora regreso y me encuentro un pobre sabor platos sencillos y estúpidamente caros nada recomendable,1
474,"Estadounidense, Bar",negative,alitas asquerosas quemadas incomibles lo comento y solo me hacen un descuento de 10 es una broma nunca mas en la vida,1
475,"Japonesa, Sushi, Asiática",negative,compré dos tititcupones y para el primero asistí con mi novia el miércoles 26 de noviembre en la noche a pesar de que reservamos duraron una hora en darnos el pedido para llevar luego en la segunda ocasión el miércoles 3 de diciembre duraron una hora y media en darnos el pedido a pesar de haber reservado también como indican en su facebook y en el titicupón pero antes de eso nos quisieron levantar de la mesa en la que estábamos esperando nos cobraron 2000 colones por el pedido para llevar aun cuando en el titicupón sólo decía “pedidos para llevar 1000 colones” sin especificar que es por recipiente y cuando le exigimos una factura timbrada la cual no nos dio nos amenazó con llamar a seguridad me parece que se aprovechan del cliente porque saben que uno ya pagó el titicupón por adelantado además el administrador carece totalmente de empatía con el cliente recomiendo evitar lugares como ese a menos de que tengan una hora o más tiempo que quieran malgastar restaurantes de sushi hay por todo lado en estos días con precios módicos y buena atención por último dan una salsa de anguila que parece que le hayan echado vainilla líquida en lo personal sabe terrible,1
476,N/E,negative,fui un sábado a almorzar a este restaurante primero la atención deja mucho que desear servicio pésimo se pide que si se pueden hacer los dedos de pollo asados y no empanizados y dicen que no pedí un sándwich lorenzo light y venía en pan cuadrado frío las capas se estaban cayendo y el sabor era realmente horroroso termine con el estómago revuelto y las ganas de no volver uno pensaría que un sándwich no le puede quedar mal a nadie pero aquí me demostraron que sí,1
477,N/E,negative,nunca había ido y nunca volveré los refrescos calientes el hielo parece que no lo conocen la comida una porquería que se come mejor en cualquier soda de barrio hasta la peor es mejor que eso y la atención pésima principalmente de la cajera que tiene una pésima actitud,1
478,"Costarricense, Centroamericana, Churrasquería, Mariscos, Sopas",positive,un excelente ambiente para venir con la familia y amigos excelente servicio la comida muy rica y se puede venír con las mascotas,5
479,"Churrasquería, Latina, Argentina",negative,muy diferente a el novillo alegre del valle central limitadísimas opciones de carnes poca variedad del menú demasiado lenta la atención y olvidan los pendientes con los clientes hasta que se les recuerda definitivamente hay muchas mejores opciones locales que este restaurante,2
480,"Bar, Pub",positive,¡qué gran bar de cerveza para cualquier angloparlante en jaco este es un gran lugar para una noche tranquila y una excelente cerveza artesanal el propietario daniel es un expatriado de canadá y es totalmente hospitalario para una noche lejos de la típica noche de jaco ¡mira este lugar,5
481,"Bar, Pub",positive,visitamos el establecimiento de dan y me encantó el pequeño espacio acogedor se puede decir un montón de tiempo y esfuerzo han puesto en crear una atmósfera de pubhay una gran selección de artesanías cerveza de barril para que elijas en artesanías y disfrutar de una cerveza fría y una buena conversación,5
482,"Bar, Pub",positive,gran selección de cerveza es un lugar bastante bueno para sentarse y tienen algunas cervezas la comida parecía bueno también pero fuimos allí específicamente para tomar una copa,5
483,"Bar, Pub",positive,este es un lugar pequeño y pintoresco en la franja de jaco un poco dulce para disfrutar hideout cervezas auténticas artesanías de costa rica el propietario edgar es un anfitrión bien informado y elegante y entusiastas de artesanía obvio cerveza,5
484,"Asiática, Tailandesa, Saludable",positive,este lugar es verdaderamente una joya propiedad de una pareja que recientemente se trasladó desde alemania a seguir sus sueños el marido chef estudió cocina tailandesa en tailandia y trae los auténticos sabores de jaco he viajado a tailandia y esta comida es una de los mejores tailandés que he probado recomendaría este lugar a cualquiera que aprecie el sabor es evidente que la comida está hecha con pasión y profesionalidad el ambiente del restaurante es muy acogedor y el servicio es increíble debe probar mientras en jaco,5
485,"Estadounidense, Mariscos, Centroamericana, Costarricense, Internacional",positive,el lugar muy hermoso en la montaña precioso jardín el atardecer muy lindo la comida deliciosa especial para una cena romántica,5
486,"Estadounidense, Mariscos, Centroamericana, Costarricense, Internacional",positive,he viajado mucho y siempre estoy buscando esos tesoros ocultos aquellos fuera de la rutina experiencias que puedes encontrar por conocer a alguien que te dice que local sobre algo increíble y así lo hace y luego quiere decir todo el mundo solía ser un visitante aquí en costa rica luego me dieron la increíble oportunidad de vivir aquí y ahora me voy a un visitante nuevo pero recuerdo la primera vez que oí hablar de aventura y pensamos que ¡qué guay idea después de que finalmente se alrededor a hacerlo que no podía creer que no le había hecho antes y cada vez que vuelvo es tan increíble como recuerdo mi primera vez en realidad está incluso mejor y mi parte favorita está reuniendo a personas que nunca han sido y ver sus reacciones comedor de aventura no es ir a cenar es una experiencia para encontrar escondida lejos de las multitudes experiencia que tienes que ver para entender es como ser transportado a un lugar muy especial donde tienes suerte de haber encontrado este lugar que los propietarios han creado y a ser parte de la misma recuerdo cómo quería casarse aquí y guardar mi recepción aquí a pesar de que yo no era incluso casarse jajaja es ese tipo de espectacular si te encanta hermosa virgen vistas plantas tropicales y sonidos gente amable escondidos tesoros debe asegúrese de ir y saludan a david y cindy para mí son divertidas divertido muy dulce y muy imaginativo han creado este lugar impresionante es un poco para llegar aquí pero conseguir ir vale la pena,5
487,"Mexicana, Estadounidense, Costarricense, Mariscos, Centroamericana",negative,la comida no me gusto para nada pedí un guacamole que no estaba fresco y unos tacos de carne que prácticamente no tenían carne,2
488,"Italiana, Estadounidense, Pizzería",positive,en un país donde la comida es bastante aburrido no utilizar muchas especias la pizzería es el santo grial de pizzerías en el mundo tienen todos los ingredientes frescos y ahora cómo hacer que te sientas como en casa lejos de casa hazte un favor venga a conocer este lugar kevin y joe hará que la derecha,5
489,"Italiana, Estadounidense, Pizzería",positive,no hay pizza en jaco que se pueda comparar a las tiendas pizza es el mejoreste lugar ha recuperado seria desde su nueva adquisición de la propiedad hace un año puedes ver a los propietarios son un apasionado de hacer pizza de calidad porque utilizan ingredientes frescos y locales no tienen altas expectativas para pizza en cr pero estos chicos son realmente poner su cuerpo y alma mantienen sencillo y permitir la comida habla por sí mismo probamos casi cada combinación en el menú normal así como un par de las sugerencias del propietario y nos quedamos muy contentos con todas ellas también tienen sandwiches sopas de pan tazones y alas sus alas fueron algunos de los mejores que he probado en mi vida nos gustó la comida y el servicio que nos comimos aquí por lo menos cuatro veces durante nuestra semana visita pasado juliolos dueños son muy amables e incluso se tomaron el tiempo para familiarizarse con nosotros en una primera base de nombre nos trataron como si fuéramos de la familia desde el primer momento nos fuimosel lugar era también muy limpia incluyendo el aseo como puede ver todo lo que pasa en la cocina mientras su comida es preparada esto es raro en jaco y estar en un país extranjero sin duda apreciamos esta transparencia espero que estos chicos mantener vivir el sueño y la mejor pizza de jaco no cabe duda de que volveremos,5
490,"Italiana, Estadounidense, Pizzería",negative,lo peor pizza en la ciudad y pizza en costa rica está mal para empezar además es bastante caro aunque tienen una media de noche,1
491,"Parrilla, Fusión",positive,muy buena opción de alimentación en jacó en un centro gastronómico que invita a seleccionar lo mejor de la comida internacional muy buena atención y comida alternativa para todos,5
492,"Parrilla, Fusión",positive,todo lo que puedo decir es que la comida el servicio al cliente y el ambiente era maravilloso y sin duda volvería otra vez mi plato estaba la carne tenderloins y era fantástico tan tierno muy delicioso gran trabajo de graffiti volveremos,5
493,"Parrilla, Fusión",positive,el restaurante era increíblemente buena la comida era deliciosa el personal era muy servicial todo el mundo hablaba inglés el restaurante está muy limpio es muy agradable y está muy tranquila,5
494,"Parrilla, Fusión",positive,este es un tesoro escondido con una experiencia magnífica y comida excepcional 10 de 10 de graffiti si quieres una noche chill increíble este es el lugar en el que se haga su paladar cantar,5
495,"Parrilla, Fusión",positive,recientemente tomó unas vacaciones a la hermosa jaco sólo sobre esta joya oído de la gente decidí que era el lugar perfecto para pop la gran pregunta a mi novia el personal no podría haber sido más amable o más precioso en realidad me sentí como si estuviera en una sesión de calvin klein los dueños eran tan agradables que nos compensaron unas rondas de bebidas y postres para mi nuevo novio y i no podría ser más impresionante recomiendo encarecidamente el lomo de ternera tenía la ternura de un filete y el rabil ustedes rock,5
496,"Parrilla, Fusión",negative,siempre elija restaurantes antes según sus críticas en ta teníamos grandes expectativas para graffiti pero ninguno de ellos recibiócómo fue el servicio bien a pesar de personal superando los huéspedes de 4 a 1 fue lenta y muy indiferente el personal era mucho más interesados en hablar entre sí que servir a los clientes nos sentíamos como si representaran a una fiesta privada versus un restaurante público muy extraño y bastante desagradablecómo era la comida el 50 de éxito era un plato caliente y sabroso dos eran inexpresivo y correosos misma suerte en los platos principales uno era bueno y el otro era sosa y podría haber utilizado salmuchos comentarios excelente significa que los cogimos en un muy mal día y eso sucede sólo desearía que no hubiera sucedido nos encantan los pequeños restaurantes únicos y realmente quería este es uno de ellos,2
497,"Parrilla, Fusión",positive,familia de cinco 15 20 por plato selección de la feria de bebidas gran conocedor servidor y la comida estaba muy rica tuve el mahi mahi ennegrecido familia tenía chuletas de cerdo hamburguesa y filete todos disfrutaron de sus comidas,5
498,"Parrilla, Fusión",negative,terminamos en graffiti es porque de las otras críticas al entrar nos quedamos los primeros clientes de la noche la primera bandera roja realmente no sabía qué queríamos tomar pedimos agua eso es cuando nuestra camarera desarrollado una actitud sin importancia no recuerdo su nombre pero ella tenía un tatuaje en su hombro derecho empezamos con los calamares por us800 nos dieron 8 calamares muy pequeño con una pequeña taza de deliciosa salsa mojar para la cena nos pedimos la pasta alfredo de la junta negra de split una vez que la camarera nos enteramos de que sólo estábamos pidiendo un plato nos dieron actitud más por us2100 nos dieron un poco de pasta básica con salsa alfredo y 8 camarones ragu buen tamaño de tipo con un pequeño toque de lejía en ellos y algunos muy sabroso brócoli marie callander podrían poner este plato de negocios un trozo de pan habría sido muy bonito pero yo estaba enferma de la actitud dos partidos diferentes y acabé sentada a ambos lados de nosotros una era regular y no conseguí actitud pero los patrones en el otro lado eran dos chicas que viajan juntos y gestión habló sobre la actitud de la camarera el restaurante es un lugar muy bonito con aspecto que es un poco lejos del centro de la ciudad con un gran potencial rodamiento con extremo cuidado,2
499,"Parrilla, Fusión",positive,no estoy seguro de cómo preparar su carne pero era la mejor carne que he probado en mi vida no puedo parar pensar en ella se admiten perros de maíz de langosta y aperitivo de atún cajún eran alucinantes me encanta este lugar,5
500,"Parrilla, Fusión",positive,todo sobre graffiti es genial las bebidas son point la comida es deliciosa y el personal es muy atento volveré pronto,5
501,"Parrilla, Fusión",negative,comimos en graffiti basándonos en los comentarios en tripadvisor y supongo que tenía mis esperanzas demasiado alto todas las camareras hablaba inglés pero me dieron un mejor servicio en los restaurantes donde principalmente hablaba español el servicio lento es lo que se espera en costa rica pero con el ambiente muy americano nos esperaba un poco más rápido servicio me dieron costillas que estaban bien pero nada especial y mi prometido dieron deslizantes que estaban bien pero cuando estoy visitando un país extranjero no estoy buscando comida americana algunas personas de nuestro grupo nos dieron una cajún camarones plato de pasta que nos dijeron que era la más horrible comida tenían mientras en costa rica,2
502,"Parrilla, Fusión",positive,mi hermana y comimos dos tipos diferentes de cheesecake aquí que eran absolutamente maravilloso también tuvimos una bebida que fueron elaboradas y muy agradable el único inconveniente es que los precios son bastante altos,4
503,"Parrilla, Fusión",positive,esto es algo que debe parar si estás en la zona uno de los mejores restaurantes que he probado no sólo en costa rica pero en mis viajes de san francisco o nueva york restaurantes,5
504,"Parrilla, Fusión",positive,graffiti en una palabra increíble la mezcla ecléctica de graffitis ilustraciones y fotografías enmarcadas de talentos locales hace que el ambiente acogedor e interesante para tomar mientras cena el servicio es excelente amable servicial y increíblemente informados acerca de la comida la comida es excelente la mejor comida que he tenido en jaco sin duda cada plato es poner juntos con tanta atención al detalle y el cuidado que casi no te sientes mal comer también tienen creativos cócteles y deliciosos como un martini de albahaca de pepino que es para morirse perfecto para una cena íntima entre amigos o una celebración grande de grupo si estás en jaco tienes que probar este lugar,5
505,"Parrilla, Fusión",positive,el mejor restaurante de la ciudad pequeño lugar vienen temprano o hacer una reserva café excepcional crusted steak,5
506,"Latina, Mariscos, Centroamericana, Costarricense, Fusión",negative,no lo recomiendo me salió un pelo gigante en el ceviche que estaba tan envuelto con la comida que parecía parte del plato la atención no es buena,1
507,"Latina, Mariscos, Centroamericana, Costarricense, Fusión",positive,excelente lugar buena atención la comida muy buena y las margaritas geniales a pesar de que esa tarde noche la lluvia fue demasiado y se inundo de agua lo recomiendo,5
508,"Latina, Mariscos, Centroamericana, Costarricense, Fusión",positive,la comida es buena especialmente sus platos de pasta aae aquí dos veces y disfrutamos de ambas veces se puede comer fuera en el patio o en el interior del aire acondicionado le gusta comer aquí,5
509,"Latina, Mariscos, Centroamericana, Costarricense, Fusión",positive,esta es una visita obligada comer en jaco el personal es profesional y muy amable muy servicial y genial comunicadores tienen una buena wiifi y quedamos muy contentos para mí para sentarse a 2 12 horas mientras esperaba para un paseo en una tarde bebí una margarita y tenía las alas de pollo que estaban deliciosos fuimos a otro día para una comida completa de carne y era preciosa,5
